Title,Publication Day,Publication Month,Publication Year,Journal Name,Journal Volume,Journal Issue,Journal ISSN,Author 1 First Name,Author 1 Last Name,Author 1 Affiliation,Author 2 First Name,Author 2 Last Name,Author 2 Affiliation,Author 3 First Name,Author 3 Last Name,Author 3 Affiliation,Author 4 First Name,Author 4 Last Name,Author 4 Affiliation,Author 5 First Name,Author 5 Last Name,Author 5 Affiliation,Author 6 First Name,Author 6 Last Name,Author 6 Affiliation,Author 7 First Name,Author 7 Last Name,Author 7 Affiliation,Author 8 First Name,Author 8 Last Name,Author 8 Affiliation,Author 9 First Name,Author 9 Last Name,Author 9 Affiliation,Author 10 First Name,Author 10 Last Name,Author 10 Affiliation,Author 11 First Name,Author 11 Last Name,Author 11 Affiliation,Author 12 First Name,Author 12 Last Name,Author 12 Affiliation,Author 13 First Name,Author 13 Last Name,Author 13 Affiliation,Author 14 First Name,Author 14 Last Name,Author 14 Affiliation,Author 15 First Name,Author 15 Last Name,Author 15 Affiliation,Author 16 First Name,Author 16 Last Name,Author 16 Affiliation,Author 17 First Name,Author 17 Last Name,Author 17 Affiliation,Publisher Name,Publisher Location,ISBN 1,ISBN 2,Author 18 First Name,Author 18 Last Name,Author 18 Affiliation,Author 19 First Name,Author 19 Last Name,Author 19 Affiliation,Collective Author 1,Author 20 First Name,Author 20 Last Name,Author 20 Affiliation,Author 21 First Name,Author 21 Last Name,Author 21 Affiliation,Author 22 First Name,Author 22 Last Name,Author 22 Affiliation,Author 23 First Name,Author 23 Last Name,Author 23 Affiliation,Author 24 First Name,Author 24 Last Name,Author 24 Affiliation,Author 25 First Name,Author 25 Last Name,Author 25 Affiliation,Author 26 First Name,Author 26 Last Name,Author 26 Affiliation,Author 27 First Name,Author 27 Last Name,Author 27 Affiliation,Author 28 First Name,Author 28 Last Name,Author 28 Affiliation,Author 29 First Name,Author 29 Last Name,Author 29 Affiliation,Author 30 First Name,Author 30 Last Name,Author 30 Affiliation,Author 31 First Name,Author 31 Last Name,Author 31 Affiliation,Author 32 First Name,Author 32 Last Name,Author 32 Affiliation,Author 33 First Name,Author 33 Last Name,Author 33 Affiliation
an artificial intelligence tool to predict fluid requirement in the intensive care unit: a proof-of-concept study,01,12,2008,"Critical care (London, England)",12,6,1466-609X,Leo Anthony,Celi,"Laboratory of Computer Science, Massachusetts General Hospital, 50 Staniford Street, 7th floor, Boston, MA 02114, USA. lceli@mit.edu",L Christian,Hinske,,Gil,Alterovitz,,Peter,Szolovits,,,,,,,,,,,,,,,,,,,,,,,,,,,,,,,,,,,,,,,,,,,,,,,,,,,,,,,,,,,,,,,,,,,,,,,,,,,,,,,,,,,,,,,,,,,,,
predicting icu hemodynamic instability using continuous multiparameter trends,XX,XX,2008,Annual International Conference of the IEEE Engineering in Medicine and Biology Society. IEEE Engineering in Medicine and Biology Society. Annual International Conference,2008,,2375-7477,Hanqing,Cao,"Philips Research North America, Briarcliff Manor, NY 10510, USA. hanqing.cao@philips.com",Larry,Eshelman,,Nicolas,Chbat,,Larry,Nielsen,,Brian,Gross,,Mohammed,Saeed,,,,,,,,,,,,,,,,,,,,,,,,,,,,,,,,,,,,,,,,,,,,,,,,,,,,,,,,,,,,,,,,,,,,,,,,,,,,,,,,,,,,,,,
reducing false alarm rates for critical arrhythmias using the arterial blood pressure waveform,21,03,2008,Journal of biomedical informatics,41,3,1532-0480,Anton,Aboukhalil,"Massachusetts Institute of Technology, Cambridge, MA, USA.",Larry,Nielsen,,Mohammed,Saeed,,Roger G,Mark,,Gari D,Clifford,,,,,,,,,,,,,,,,,,,,,,,,,,,,,,,,,,,,,,,,,,,,,,,,,,,,,,,,,,,,,,,,,,,,,,,,,,,,,,,,,,,,,,,,,,
predicting respiratory instability in the icu,XX,XX,2008,Annual International Conference of the IEEE Engineering in Medicine and Biology Society. IEEE Engineering in Medicine and Biology Society. Annual International Conference,2008,,2375-7477,Colleen M,Ennett,"Philips Research North America, Briarcliff Manor, NY, USA. colleen.ennett@philips.com",K P,Lee,,Larry J,Eshelman,,Brian,Gross,,Larry,Nielsen,,Joseph J,Frassica,,Mohammed,Saeed,,,,,,,,,,,,,,,,,,,,,,,,,,,,,,,,,,,,,,,,,,,,,,,,,,,,,,,,,,,,,,,,,,,,,,,,,,,,,,,,,,,,
development and evaluation of predictive alerts for hemodynamic instability in icu patients,06,11,2008,AMIA ... Annual Symposium proceedings. AMIA Symposium,,,1942-597X,Larry J,Eshelman,"Philips Research North America, Briarcliff Manor, NY, USA.",K P,Lee,,Joseph J,Frassica,,Wei,Zong,,Larry,Nielsen,,Mohammed,Saeed,,,,,,,,,,,,,,,,,,,,,,,,,,,,,,,,,,,,,,,,,,,,,,,,,,,,,,,,,,,,,,,,,,,,,,,,,,,,,,,,,,,,,,,
