natural language processing of electronic health records is superior to billing codes to identify symptom burden in hemodialysis patients,09,11,2019,Kidney international,97,2,1523-1755,Lili,Chan,"Division of Nephrology, Department of Medicine, Icahn School of Medicine at Mount Sinai, New York, New York, USA; The Charles Bronfman Institute for Personalized Medicine, Department of Genetics and Genomics Sciences, Icahn School of Medicine at Mount Sinai, New York, New York, USA. Electronic address: lili.chan@mountsinai.org.",Kelly,Beers,"Division of Nephrology, Department of Medicine, Icahn School of Medicine at Mount Sinai, New York, New York, USA.",Amy A,Yau,"Division of Nephrology, Department of Medicine, Icahn School of Medicine at Mount Sinai, New York, New York, USA.",Kinsuk,Chauhan,"Division of Nephrology, Department of Medicine, Icahn School of Medicine at Mount Sinai, New York, New York, USA.",Áine,Duffy,"The Charles Bronfman Institute for Personalized Medicine, Department of Genetics and Genomics Sciences, Icahn School of Medicine at Mount Sinai, New York, New York, USA.",Kumardeep,Chaudhary,"The Charles Bronfman Institute for Personalized Medicine, Department of Genetics and Genomics Sciences, Icahn School of Medicine at Mount Sinai, New York, New York, USA.",Neha,Debnath,"Division of Nephrology, Department of Medicine, Icahn School of Medicine at Mount Sinai, New York, New York, USA.",Aparna,Saha,"The Charles Bronfman Institute for Personalized Medicine, Department of Genetics and Genomics Sciences, Icahn School of Medicine at Mount Sinai, New York, New York, USA.",Pattharawin,Pattharanitima,"Division of Nephrology, Department of Medicine, Icahn School of Medicine at Mount Sinai, New York, New York, USA.",Judy,Cho,"The Charles Bronfman Institute for Personalized Medicine, Department of Genetics and Genomics Sciences, Icahn School of Medicine at Mount Sinai, New York, New York, USA.",Peter,Kotanko,"Division of Nephrology, Department of Medicine, Icahn School of Medicine at Mount Sinai, New York, New York, USA; Renal Research Institute, New York, New York, USA.",Alex,Federman,"Division of General Internal Medicine, Department of Medicine, Icahn School of Medicine at Mount Sinai, New York, New York, USA.",Steven G,Coca,"Division of Nephrology, Department of Medicine, Icahn School of Medicine at Mount Sinai, New York, New York, USA.",Tielman,Van Vleck,"The Charles Bronfman Institute for Personalized Medicine, Department of Genetics and Genomics Sciences, Icahn School of Medicine at Mount Sinai, New York, New York, USA.",Girish N,Nadkarni,"Division of Nephrology, Department of Medicine, Icahn School of Medicine at Mount Sinai, New York, New York, USA; The Charles Bronfman Institute for Personalized Medicine, Department of Genetics and Genomics Sciences, Icahn School of Medicine at Mount Sinai, New York, New York, USA. Electronic address: girish.nadkarni@mountsinai.org.",,,,,,,,,,,,,,,,,,,,,,,,,,,,,,,,,,,,,,,,,,,,,,,,,,,,,,,,,,,
effects of circadian heart rate variation on short-term and long-term mortality in intensive care unit patients: a retrospective cohort study based on mimic-ii database,XX,09,2019,Zhonghua wei zhong bing ji jiu yi xue,31,9,2095-4352,Yanni,Luo,"Department of Critical Care Medicine, the Second Affiliated Hospital of Xi'an Jiaotong University, Xi'an 710004, Shaanxi, China. Corresponding author: Wang Gang, Email: gang_wang@xjtu.edu.cn.",Jingjing,Zhang,,Ruohan,Li,,Ya,Gao,,Yanli,Hou,,Jiamei,Li,,Xiaochuang,Wang,,Gang,Wang,,,,,,,,,,,,,,,,,,,,,,,,,,,,,,,,,,,,,,,,,,,,,,,,,,,,,,,,,,,,,,,,,,,,,,,,,,,,,,,,,
early prediction of acute kidney injury in critical care setting using clinical notes and structured multivariate physiological measurements,21,08,2019,Studies in health technology and informatics,264,,1879-8365,Mengxin,Sun,"Chicago, IL, USA.",Jason,Baron,"Department of Pathology, Massachusetts General Hospital, Boston, MA, USA.",Anand,Dighe,"Department of Pathology, Massachusetts General Hospital, Boston, MA, USA.",Peter,Szolovits,"Computer Science and Artificial Intelligence Lab, MIT, Cambridge, MA, USA.",Richard G,Wunderink,"Feinberg School of Medicine, Northwestern University, Chicago, IL, USA.",Tamara,Isakova,"Feinberg School of Medicine, Northwestern University, Chicago, IL, USA.",Yuan,Luo,"Feinberg School of Medicine, Northwestern University, Chicago, IL, USA.",,,,,,,,,,,,,,,,,,,,,,,,,,,,,,,,,,,,,,,,,,,,,,,,,,,,,,,,,,,,,,,,,,,,,,,,,,,,,,,,,,,
increased body mass index linked to greater short- and long-term survival in sepsis patients: a retrospective analysis of a large clinical database,26,07,2019,International journal of infectious diseases : IJID : official publication of the International Society for Infectious Diseases,87,,1878-3511,Shuhe,Li,"Department of Critical Care Medicine, The First Affiliated Hospital of Sun Yat-Sen University, Guangzhou, 510080, China. Electronic address: lish7@mail2.sysu.edu.cn.",Xiaoguang,Hu,"Department of Critical Care Medicine, The First Affiliated Hospital of Sun Yat-Sen University, Guangzhou, 510080, China. Electronic address: huxiaog@mail2.sysu.edu.cn.",Jinghong,Xu,"Department of Critical Care Medicine, The First Affiliated Hospital of Sun Yat-Sen University, Guangzhou, 510080, China; Guangdong Provincial Key Laboratory of Organ Donation and Transplant Immunology, Guangzhou, 510080, China. Electronic address: xujh38@mail2.sysu.edu.cn.",Fa,Huang,"Department of Critical Care Medicine, The First Affiliated Hospital of Sun Yat-Sen University, Guangzhou, 510080, China; Guangdong Provincial Key Laboratory of Organ Donation and Transplant Immunology, Guangzhou, 510080, China. Electronic address: huangf56@mail2.sysu.edu.cn.",Zilu,Guo,"Department of Statistics, William March Rice University, 6100 Main St., Houston, TX 77005, USA. Electronic address: zg12@rice.edu.",Li,Tong,"Department of Critical Care Medicine, The First Affiliated Hospital of Sun Yat-Sen University, Guangzhou, 510080, China. Electronic address: tongli2@mail2.sysu.edu.cn.",Ka Yin,Lui,"Department of Critical Care Medicine, The First Affiliated Hospital of Sun Yat-Sen University, Guangzhou, 510080, China. Electronic address: lvjiax@mail2.sysu.edu.cn.",Lu,Cao,"Department of Extracorporeal Circulation, The First Affiliated Hospital of Sun Yat-Sen University, Guangzhou, 510080, China. Electronic address: caolu3@mail2.sysu.edu.cn.",Yanping,Zhu,"Department of Critical Care Medicine, The First Affiliated Hospital of Sun Yat-Sen University, Guangzhou, 510080, China. Electronic address: zhuyp8@mail2.sysu.edu.cn.",Jiyou,Yao,"Department of Hepatobiliary Surgery, Guangzhou First People's Hospital, Guangzhou 510180, China. Electronic address: yaojy23@mail2.sysu.edu.cn.",Xiaobin,Lin,"Department of Pharmacology, The First Affiliated Hospital of Sun Yat-Sen University, Guangzhou, 510080, China. Electronic address: linxb6@mail2.sysu.edu.cn.",Xiangdong,Guan,"Department of Critical Care Medicine, The First Affiliated Hospital of Sun Yat-Sen University, Guangzhou, 510080, China. Electronic address: carlg@163.com.",Changjie,Cai,"Department of Critical Care Medicine, The First Affiliated Hospital of Sun Yat-Sen University, Guangzhou, 510080, China. Electronic address: caichjie@mail.sysu.edu.cn.",,,,,,,,,,,,,,,,,,,,,,,,,,,,,,,,,,,,,,,,,,,,,,,,,,,,,,,,,,,,,,,,,
deep reinforcement learning for optimal critical care pain management with morphine using dueling double-deep q networks,XX,07,2019,Annual International Conference of the IEEE Engineering in Medicine and Biology Society. IEEE Engineering in Medicine and Biology Society. Annual International Conference,2019,,2694-0604,Daniel,Lopez-Martinez,,Patrick,Eschenfeldt,,Sassan,Ostvar,,Myles,Ingram,,Chin,Hur,,Rosalind,Picard,,,,,,,,,,,,,,,,,,,,,,,,,,,,,,,,,,,,,,,,,,,,,,,,,,,,,,,,,,,,,,,,,,,,,,,,,,,,,,,,,,,,,,,
machine learning for the prediction of volume responsiveness in patients with oliguric acute kidney injury in critical care,08,04,2019,"Critical care (London, England)",23,1,1466-609X,Zhongheng,Zhang,"Department of Emergency Medicine, Sir Run Run Shaw Hospital, Zhejiang University School of Medicine, No. 3, East Qingchun Road, Hangzhou, 310016, Zhejiang Province, China. zh_zhang1984@zju.edu.cn.",Kwok M,Ho,"School of Population and Global Health, University of Western Australia, Perth, Australia.",Yucai,Hong,"Department of Emergency Medicine, Sir Run Run Shaw Hospital, Zhejiang University School of Medicine, No. 3, East Qingchun Road, Hangzhou, 310016, Zhejiang Province, China.",,,,,,,,,,,,,,,,,,,,,,,,,,,,,,,,,,,,,,,,,,,,,,,,,,,,,,,,,,,,,,,,,,,,,,,,,,,,,,,,,,,,,,,,,,,,,,,
novel method of atrial fibrillation case identification and burden estimation using the mimic-iii electronic health data set,28,07,2019,Journal of intensive care medicine,34,10,1525-1489,Eric Y,Ding,"1 Department of Population and Quantitative Health Sciences, University of Massachusetts Medical School, Worcester, MA, USA.",Daniella,Albuquerque,"2 Division of Cardiology, Department of Medicine, University of Massachusetts Medical School, MA, USA.",Michael,Winter,"3 Biostatistics and Epidemiology Data Analytics Center, Boston University School of Public Health, MA, USA.",Sophia,Binici,"2 Division of Cardiology, Department of Medicine, University of Massachusetts Medical School, MA, USA.",Jaclyn,Piche,"2 Division of Cardiology, Department of Medicine, University of Massachusetts Medical School, MA, USA.",Syed Khairul,Bashar,"4 Department of Biomedical Engineering, University of Connecticut, CT, USA.",Ki,Chon,"4 Department of Biomedical Engineering, University of Connecticut, CT, USA.",Allan J,Walkey,"5 Pulmonary Center, Boston University School of Medicine, MA, USA.",David D,McManus,"1 Department of Population and Quantitative Health Sciences, University of Massachusetts Medical School, Worcester, MA, USA.",,,,,,,,,,,,,,,,,,,,,,,,,,,,,,,,,,,,,,,,,,,,,,,,,,,,,,,,,,,,,,,,,,,,,,,,,,,,,
using a multi-task recurrent neural network with attention mechanisms to predict hospital mortality of patients,13,05,2019,IEEE journal of biomedical and health informatics,24,2,2168-2208,Ruoxi,Yu,,Yali,Zheng,,Ruikai,Zhang,,Yuqi,Jiang,,Carmen C Y,Poon,,,,,,,,,,,,,,,,,,,,,,,,,,,,,,,,,,,,,,,,,,,,,,,,,,,,,,,,,,,,,,,,,,,,,,,,,,,,,,,,,,,,,,,,,,
red blood cell distribution width is associated with all-cause mortality in critically ill patients with cardiogenic shock,18,09,2019,Medical science monitor : international medical journal of experimental and clinical research,25,,1643-3750,Benji,Wang,"Department of Cardiology, The First Affiliated Hospital of Xinjiang Medical University, Urumqi, Xinjiang, China (mainland).",Gulandanmu,Aihemaiti,"Department of Cardiology, The First Affiliated Hospital of Xinjiang Medical University, Urumqi, Xinjiang, China (mainland).",Bihuan,Cheng,"Department of Anesthesiology, Critical Care and Pain Medicine, The Second Affiliated Hospital and Yuying Children's Hospital of Wenzhou Medical University, Wenzhou, Zhejiang, China (mainland).",Xiaomei,Li,"Department of Cardiology, The First Affiliated Hospital of Xinjiang Medical University, Urumqi, Xinjiang, China (mainland).",,,,,,,,,,,,,,,,,,,,,,,,,,,,,,,,,,,,,,,,,,,,,,,,,,,,,,,,,,,,,,,,,,,,,,,,,,,,,,,,,,,,,,,,,,,,
a concept for graph-based temporal similarity of patient data,21,08,2019,Studies in health technology and informatics,264,,1879-8365,Matthias,Ganzinger,"Institute of Medical Biometry and Informatics, Heidelberg University, Heidelberg, Germany.",Jens,Schrodt,"Institute of Medical Biometry and Informatics, Heidelberg University, Heidelberg, Germany.",Petra,Knaup,"Institute of Medical Biometry and Informatics, Heidelberg University, Heidelberg, Germany.",,,,,,,,,,,,,,,,,,,,,,,,,,,,,,,,,,,,,,,,,,,,,,,,,,,,,,,,,,,,,,,,,,,,,,,,,,,,,,,,,,,,,,,,,,,,,,,
mining compact predictive pattern sets using classification model,30,05,2019,Artificial intelligence in medicine. Conference on Artificial Intelligence in Medicine (2005- ),11526,,,Matteo,Mantovani,"Department of Computer Science, University of Verona, Italy.",Carlo,Combi,"Department of Computer Science, University of Verona, Italy.",Milos,Hauskrecht,"Department of Computer Science, University of Pittsburgh, Pittsburgh, USA.",,,,,,,,,,,,,,,,,,,,,,,,,,,,,,,,,,,,,,,,,,,,,,,,,,,,,,,,,,,,,,,,,,,,,,,,,,,,,,,,,,,,,,,,,,,,,,,
"towards a decision support tool for intensive care discharge: machine learning algorithm development using electronic healthcare data from mimic-iii and bristol, uk",07,03,2019,BMJ open,9,3,2044-6055,Christopher J,McWilliams,"Engineering Mathematics, University of Bristol, Bristol, UK.",Daniel J,Lawson,"Integrative Epidemiology Unit, Population Health Sciences, University of Bristol, Bristol, UK.",Raul,Santos-Rodriguez,"Engineering Mathematics, University of Bristol, Bristol, UK.",Iain D,Gilchrist,"Department of Experimental Psychology, University of Bristol, Bristol, UK.",Alan,Champneys,"Engineering Mathematics, University of Bristol, Bristol, UK.",Timothy H,Gould,"Intensive Care Unit, University Hospitals Bristol NHS Foundation Trust, Bristol, UK.",Mathew Jc,Thomas,"Intensive Care Unit, University Hospitals Bristol NHS Foundation Trust, Bristol, UK.",Christopher P,Bourdeaux,"Intensive Care Unit, University Hospitals Bristol NHS Foundation Trust, Bristol, UK.",,,,,,,,,,,,,,,,,,,,,,,,,,,,,,,,,,,,,,,,,,,,,,,,,,,,,,,,,,,,,,,,,,,,,,,,,,,,,,,,
association of serum total and ionized calcium with all-cause mortality incritically ill patients with acute kidney injury,16,03,2019,Clinica chimica acta; international journal of clinical chemistry,494,,1873-3492,Benji,Wang,"Department of Anesthesiology, Critical Care and Pain Medicine, The Second Affiliated Hospital and Yuying Children's Hospital of Wenzhou Medical University, Wenzhou 325000, Zhejiang, China.",Diwen,Li,"Department of Anesthesiology, Critical Care and Pain Medicine, The Second Affiliated Hospital and Yuying Children's Hospital of Wenzhou Medical University, Wenzhou 325000, Zhejiang, China.",Yuqiang,Gong,"Department of Anesthesiology, Critical Care and Pain Medicine, The Second Affiliated Hospital and Yuying Children's Hospital of Wenzhou Medical University, Wenzhou 325000, Zhejiang, China.",Binyu,Ying,"Department of Anesthesiology, Critical Care and Pain Medicine, The Second Affiliated Hospital and Yuying Children's Hospital of Wenzhou Medical University, Wenzhou 325000, Zhejiang, China.",Bihuan,Cheng,"Department of Anesthesiology, Critical Care and Pain Medicine, The Second Affiliated Hospital and Yuying Children's Hospital of Wenzhou Medical University, Wenzhou 325000, Zhejiang, China. Electronic address: cbh@wmu.edu.cn.",,,,,,,,,,,,,,,,,,,,,,,,,,,,,,,,,,,,,,,,,,,,,,,,,,,,,,,,,,,,,,,,,,,,,,,,,,,,,,,,,,,,,,,,,
multimorbidity states associated with higher mortality rates in organ dysfunction and sepsis: a data-driven analysis in critical care,08,07,2019,"Critical care (London, England)",23,1,1466-609X,Zsolt,Zador,"Division of Neurosurgery, Department of Surgery, St. Michael's Hospital, Toronto, ON, Canada. zadzso@gmail.com.",Alexander,Landry,"Division of Neurosurgery, Department of Surgery, St. Michael's Hospital, Toronto, ON, Canada.",Michael D,Cusimano,"Division of Neurosurgery, Department of Surgery, St. Michael's Hospital, Toronto, ON, Canada.",Nophar,Geifman,"Division of Informatics, Imaging and Data Sciences, University of Manchester, Manchester, UK.",,,,,,,,,,,,,,,,,,,,,,,,,,,,,,,,,,,,,,,,,,,,,,,,,,,,,,,,,,,,,,,,,,,,,,,,,,,,,,,,,,,,,,,,,,,,
early prediction of acute kidney injury in critical care setting using clinical notes,24,01,2019,Proceedings. IEEE International Conference on Bioinformatics and Biomedicine,2018,,2156-1125,Yikuan,Li,"Dept. of EECS, Northwestern University, Evanston, IL, U.S.A.",Liang,Yao,,Chengsheng,Mao,"Dept. of Preventive Medicine, Northwestern University, Chicago, IL, U.S.A.",Anand,Srivastava,"Div. of Nephrology and Hypertension, Northwestern University, Chicago, IL, U.S.A.",Xiaoqian,Jiang,"School of Biomedical Informatics, Univ. of Texas Health Science Center, Houston, TX, U.S.A.",Yuan,Luo,"Dept. of Preventive Medicine, Northwestern University, Chicago, IL, U.S.A.",,,,,,,,,,,,,,,,,,,,,,,,,,,,,,,,,,,,,,,,,,,,,,,,,,,,,,,,,,,,,,,,,,,,,,,,,,,,,,,,,,,,,,
critical transitions in intensive care units: a sepsis case study,09,09,2019,Scientific reports,9,1,2045-2322,Pejman F,Ghalati,"Joint Research Center for Computational Biomedicine, RWTH Aachen University, 52074, Aachen, Germany.",Satya S,Samal,"Joint Research Center for Computational Biomedicine, RWTH Aachen University, 52074, Aachen, Germany.",Jayesh S,Bhat,"Joint Research Center for Computational Biomedicine, RWTH Aachen University, 52074, Aachen, Germany.",Robert,Deisz,"Klinik für Operative Intensivmedizin und Intermediate Care, Universitätsklinikum Aachen, 52074, Aachen, Germany.",Gernot,Marx,"Klinik für Operative Intensivmedizin und Intermediate Care, Universitätsklinikum Aachen, 52074, Aachen, Germany.",Andreas,Schuppert,"Joint Research Center for Computational Biomedicine, RWTH Aachen University, 52074, Aachen, Germany. schuppert@combine.rwth-aachen.de.",,,,,,,,,,,,,,,,,,,,,,,,,,,,,,,,,,,,,,,,,,,,,,,,,,,,,,,,,,,,,,,,,,,,,,,,,,,,,,,,,,,,,,
a method for the graphical modeling of relative temporal constraints,17,10,2019,Journal of biomedical informatics,100,,1532-0480,Sebastian,Mate,"Medical Centre for Information and Communication Technology, Universitätsklinikum Erlangen, Erlangen, Germany. Electronic address: sebastian.mate@uk-erlangen.de.",Thomas,Bürkle,"Bern University of Applied Sciences, Biel, Switzerland.",Lorenz A,Kapsner,"Medical Centre for Information and Communication Technology, Universitätsklinikum Erlangen, Erlangen, Germany.",Dennis,Toddenroth,"Chair of Medical Informatics, Friedrich-Alexander-Universität Erlangen-Nürnberg (FAU), Erlangen, Germany.",Marvin O,Kampf,"Medical Centre for Information and Communication Technology, Universitätsklinikum Erlangen, Erlangen, Germany.",Martin,Sedlmayr,"Institute for Medical Informatics and Biometry, Carl Gustav Carus Faculty of Medicine, Technische Universität Dresden, Dresden, Germany.",Ixchel,Castellanos,"Department of Anesthesiology, Universitätsklinikum Erlangen, Erlangen, Germany.",Hans-Ulrich,Prokosch,"Medical Centre for Information and Communication Technology, Universitätsklinikum Erlangen, Erlangen, Germany; Chair of Medical Informatics, Friedrich-Alexander-Universität Erlangen-Nürnberg (FAU), Erlangen, Germany.",Stefan,Kraus,"Chair of Medical Informatics, Friedrich-Alexander-Universität Erlangen-Nürnberg (FAU), Erlangen, Germany.",,,,,,,,,,,,,,,,,,,,,,,,,,,,,,,,,,,,,,,,,,,,,,,,,,,,,,,,,,,,,,,,,,,,,,,,,,,,,
dexmedetomidine versus midazolam and propofol for sedation in critically ill patients: mining the medical information mart for intensive care data,XX,05,2019,Annals of translational medicine,7,9,2305-5839,Yiyan,Song,"Department of Anesthesia, The First Affiliated Hospital of Sun Yat-sen University, Guangzhou 510080, China.",Shaowei,Gao,"Department of Anesthesia, The First Affiliated Hospital of Sun Yat-sen University, Guangzhou 510080, China.",Wulin,Tan,"Department of Anesthesia, The First Affiliated Hospital of Sun Yat-sen University, Guangzhou 510080, China.",Zeting,Qiu,"Zhongshan School of Medicine, Sun Yat-sen University, Guangzhou 510080, China.",Huaqiang,Zhou,"Department of Medical Oncology, Sun Yat-sen University Cancer Center, State Key Laboratory of Oncology in South China, Collaborative Innovation Center for Cancer Medicine, Guangzhou 510060, China.",Yue,Zhao,"Department of General Surgery, Guangdong Second Provincial General Hospital, Guangzhou 510310, China.",,,,,,,,,,,,,,,,,,,,,,,,,,,,,,,,,,,,,,,,,,,,,,,,,,,,,,,,,,,,,,,,,,,,,,,,,,,,,,,,,,,,,,
withholding or withdrawing invasive interventions may not accelerate time to death among dying icu patients,14,02,2019,PloS one,14,2,1932-6203,Daniele,Ramazzotti,"Department of Pathology, Stanford University, Stanford, CA, United States of America.",Peter,Clardy,"Departments of Medicine and Medical Education, Division of Pulmonary and Critical Care, Mount Auburn Hospital, Cambridge, MA, United States of America.",Leo Anthony,Celi,"Institute for Medical Engineering and Science, Massachusetts Institute of Technology, Cambridge, MA, United States of America.",David J,Stone,"Departments of Anesthesiology and Neurological Surgery, University of Virginia School of Medicine, Charlottesville, VA, United States of America.",Robert S,Rudin,"RAND Corporation, Boston, MA, United States of America.",,,,,,,,,,,,,,,,,,,,,,,,,,,,,,,,,,,,,,,,,,,,,,,,,,,,,,,,,,,,,,,,,,,,,,,,,,,,,,,,,,,,,,,,,
an intelligent warning model for early prediction of cardiac arrest in sepsis patients,11,06,2019,Computer methods and programs in biomedicine,178,,1872-7565,Samaneh,Layeghian Javan,"Faculty of Industrial and Systems Engineering, Tarbiat Modares University, Tehran 1411713116, Iran. Electronic address: samaneh.layeghian@gmail.com.",Mohammad Mehdi,Sepehri,"Faculty of Industrial and Systems Engineering, Tarbiat Modares University, Tehran 1411713116, Iran. Electronic address: mehdi.sepehri@modares.ac.ir.",Malihe,Layeghian Javan,"Mashhad University of Medical Sciences, Mashhad, Iran. Electronic address: layeghianjm@mums.ac.ir.",Toktam,Khatibi,"Faculty of Industrial and Systems Engineering, Tarbiat Modares University, Tehran 1411713116, Iran. Electronic address: toktam.khatibi@modares.ac.ir.",,,,,,,,,,,,,,,,,,,,,,,,,,,,,,,,,,,,,,,,,,,,,,,,,,,,,,,,,,,,,,,,,,,,,,,,,,,,,,,,,,,,,,,,,,,,
umls mapping and word embeddings for icd code assignment using the mimic-iii intensive care database,XX,07,2019,Annual International Conference of the IEEE Engineering in Medicine and Biology Society. IEEE Engineering in Medicine and Biology Society. Annual International Conference,2019,,2694-0604,Henning,Schafer,,Christoph M,Friedrich,,,,,,,,,,,,,,,,,,,,,,,,,,,,,,,,,,,,,,,,,,,,,,,,,,,,,,,,,,,,,,,,,,,,,,,,,,,,,,,,,,,,,,,,,,,,,,,,,,,
recent context-aware lstm for clinical event time-series prediction,30,05,2019,Artificial intelligence in medicine. Conference on Artificial Intelligence in Medicine (2005- ),11526,,,Jeong Min,Lee,"University of Pittsburgh, Pittsburgh PA 15260 USA.",Milos,Hauskrecht,"University of Pittsburgh, Pittsburgh PA 15260 USA.",,,,,,,,,,,,,,,,,,,,,,,,,,,,,,,,,,,,,,,,,,,,,,,,,,,,,,,,,,,,,,,,,,,,,,,,,,,,,,,,,,,,,,,,,,,,,,,,,,
