PMID,Title,Authors,Citation,First Author,Journal/Book,Publication Year,Create Date,PMCID,NIHMS ID,DOI
"33336212","A Hybrid Deep Learning Approach for Spatial Trigger Extraction from Radiology Reports","Datta S, Roberts K.","Proc Conf Empir Methods Nat Lang Process. 2020 Nov;2020:50-55. doi: 10.18653/v1/2020.splu-1.6.","Datta S","Proc Conf Empir Methods Nat Lang Process","2020","2020/12/18","PMC7744270","NIHMS1652961","10.18653/v1/2020.splu-1.6"
"33335586","Prognostic nutritional index predicts acute kidney injury and mortality of patients in the coronary care unit","Hu Y, Cao Q, Wang H, Yang Y, Xiong Y, Li X, Zhou Q.","Exp Ther Med. 2021 Feb;21(2):123. doi: 10.3892/etm.2020.9555. Epub 2020 Dec 3.","Hu Y","Exp Ther Med","2021","2020/12/18","PMC7739862","","10.3892/etm.2020.9555"
"33335183","Dynamic survival prediction in intensive care units from heterogeneous time series without the need for variable selection or curation","Deasy J, Liò P, Ercole A.","Sci Rep. 2020 Dec 17;10(1):22129. doi: 10.1038/s41598-020-79142-z.","Deasy J","Sci Rep","2020","2020/12/18","PMC7747558","","10.1038/s41598-020-79142-z"
"33334835","Development and validation of a prognostic nomogram for myocardial infarction patients in intensive care units: a retrospective cohort study","Guo Q, Wu M, Li H, Ouyang H, Sun R, Wang J, Liu Z, Wang J, Zhang Y.","BMJ Open. 2020 Dec 17;10(12):e040291. doi: 10.1136/bmjopen-2020-040291.","Guo Q","BMJ Open","2020","2020/12/18","PMC7747593","","10.1136/bmjopen-2020-040291"
"33333323","Domain specific word embeddings for natural language processing in radiology","Chen TL, Emerling M, Chaudhari GR, Chillakuru YR, Seo Y, Vu TH, Sohn JH.","J Biomed Inform. 2021 Jan;113:103665. doi: 10.1016/j.jbi.2020.103665. Epub 2020 Dec 15.","Chen TL","J Biomed Inform","2021","2020/12/17","PMC7856086","NIHMS1657576","10.1016/j.jbi.2020.103665"
"33332413","A deep learning backcasting approach to the electrolyte, metabolite, and acid-base parameters that predict risk in ICU patients","Dervishi A.","PLoS One. 2020 Dec 17;15(12):e0242878. doi: 10.1371/journal.pone.0242878. eCollection 2020.","Dervishi A","PLoS One","2020","2020/12/17","PMC7746262","","10.1371/journal.pone.0242878"
"33325504","Clinician involvement in research on machine learning-based predictive clinical decision support for the hospital setting: A scoping review","Schwartz JM, Moy AJ, Rossetti SC, Elhadad N, Cato KD.","J Am Med Inform Assoc. 2021 Mar 1;28(3):653-663. doi: 10.1093/jamia/ocaa296.","Schwartz JM","J Am Med Inform Assoc","2021","2020/12/16","PMC7936403","","10.1093/jamia/ocaa296"
"33323104","Hyperchloremia in critically ill patients: association with outcomes and prediction using electronic health record data","Yeh P, Pan Y, Sanchez-Pinto LN, Luo Y.","BMC Med Inform Decis Mak. 2020 Dec 15;20(Suppl 14):302. doi: 10.1186/s12911-020-01326-4.","Yeh P","BMC Med Inform Decis Mak","2020","2020/12/16","PMC7739461","","10.1186/s12911-020-01326-4"
"33319905","Ambiguity in medical concept normalization: An analysis of types and coverage in electronic health record datasets","Newman-Griffis D, Divita G, Desmet B, Zirikly A, Rosé CP, Fosler-Lussier E.","J Am Med Inform Assoc. 2021 Mar 1;28(3):516-532. doi: 10.1093/jamia/ocaa269.","Newman-Griffis D","J Am Med Inform Assoc","2021","2020/12/15","PMC7936394","","10.1093/jamia/ocaa269"
"33319904","Can reproducibility be improved in clinical natural language processing? A study of 7 clinical NLP suites","Digan W, Névéol A, Neuraz A, Wack M, Baudoin D, Burgun A, Rance B.","J Am Med Inform Assoc. 2021 Mar 1;28(3):504-515. doi: 10.1093/jamia/ocaa261.","Digan W","J Am Med Inform Assoc","2021","2020/12/15","PMC7936396","","10.1093/jamia/ocaa261"
"33314789","Association between base excess and mortality in patients with congestive heart failure","Guo W, Peng C, Liu Q, Zhao L, Guo W, Chen X, Li L.","ESC Heart Fail. 2021 Feb;8(1):250-258. doi: 10.1002/ehf2.12939. Epub 2020 Dec 11.","Guo W","ESC Heart Fail","2021","2020/12/14","PMC7835507","","10.1002/ehf2.12939"
"33313116","Admission oxygen saturation and all-cause in-hospital mortality in acute myocardial infarction patients: data from the MIMIC-III database","Yu Y, Wang J, Wang Q, Wang J, Min J, Wang S, Wang P, Huang R, Xiao J, Zhang Y, Wang Z.","Ann Transl Med. 2020 Nov;8(21):1371. doi: 10.21037/atm-20-2614.","Yu Y","Ann Transl Med","2020","2020/12/14","PMC7723567","","10.21037/atm-20-2614"
"33310809","Maximum blood glucose levels during hospitalisation to predict mortality in patients with acute coronary syndrome: a retrospective cohort study","Qian J, Kuang L, Che L, Chen F, Liu X.","BMJ Open. 2020 Dec 12;10(12):e042316. doi: 10.1136/bmjopen-2020-042316.","Qian J","BMJ Open","2020","2020/12/14","PMC7735113","","10.1136/bmjopen-2020-042316"
"33294452","The Neutrophil Percentage-to-Albumin Ratio as a New Predictor of All-Cause Mortality in Patients with Cardiogenic Shock","Yu Y, Liu Y, Ling X, Huang R, Wang S, Min J, Xiao J, Zhang Y, Wang Z.","Biomed Res Int. 2020 Nov 26;2020:7458451. doi: 10.1155/2020/7458451. eCollection 2020.","Yu Y","Biomed Res Int","2020","2020/12/09","PMC7714577","","10.1155/2020/7458451"
"33290878","Annotating social determinants of health using active learning, and characterizing determinants using neural event extraction","Lybarger K, Ostendorf M, Yetisgen M.","J Biomed Inform. 2021 Jan;113:103631. doi: 10.1016/j.jbi.2020.103631. Epub 2020 Dec 5.","Lybarger K","J Biomed Inform","2021","2020/12/08","PMC7856628","NIHMS1658127","10.1016/j.jbi.2020.103631"
"33287854","Predicting 30-days mortality for MIMIC-III patients with sepsis-3: a machine learning approach using XGboost","Hou N, Li M, He L, Xie B, Wang L, Zhang R, Yu Y, Sun X, Pan Z, Wang K.","J Transl Med. 2020 Dec 7;18(1):462. doi: 10.1186/s12967-020-02620-5.","Hou N","J Transl Med","2020","2020/12/08","PMC7720497","","10.1186/s12967-020-02620-5"
"33286923","A Nuisance-Free Inference Procedure Accounting for the Unknown Missingness with Application to Electronic Health Records","Zhao J, Chen C.","Entropy (Basel). 2020 Oct 14;22(10):1154. doi: 10.3390/e22101154.","Zhao J","Entropy (Basel)","2020","2020/12/08","PMC7597318","","10.3390/e22101154"
"33286163","Information Bottleneck for Estimating Treatment Effects with Systematically Missing Covariates","Parbhoo S, Wieser M, Wieczorek A, Roth V.","Entropy (Basel). 2020 Mar 29;22(4):389. doi: 10.3390/e22040389.","Parbhoo S","Entropy (Basel)","2020","2020/12/08","PMC7516862","","10.3390/e22040389"
"33283143","Predicting Missing Values in Medical Data via XGBoost Regression","Zhang X, Yan C, Gao C, Malin BA, Chen Y.","J Healthc Inform Res. 2020 Dec;4(4):383-394. doi: 10.1007/s41666-020-00077-1. Epub 2020 Aug 3.","Zhang X","J Healthc Inform Res","2020","2020/12/07","PMC7709926","NIHMS1617569","10.1007/s41666-020-00077-1"
"33282200","Fluctuations of driving pressure during mechanical ventilation indicates elevated central venous pressure and poor outcomes","Mao JY, Li DK, Ding X, Zhang HM, Long Y, Wang XT, Liu DW.","Pulm Circ. 2020 Nov 25;10(4):2045894020970363. doi: 10.1177/2045894020970363. eCollection 2020 Oct-Dec.","Mao JY","Pulm Circ","2020","2020/12/07","PMC7691920","","10.1177/2045894020970363"
"33282007","Serum Anion Gap Is Associated with All-Cause Mortality among Critically Ill Patients with Congestive Heart Failure","Tang Y, Lin W, Zha L, Zeng X, Zeng X, Li G, Liu Z, Yu Z.","Dis Markers. 2020 Nov 16;2020:8833637. doi: 10.1155/2020/8833637. eCollection 2020.","Tang Y","Dis Markers","2020","2020/12/07","PMC7688352","","10.1155/2020/8833637"
"33277530","Continuous and automatic mortality risk prediction using vital signs in the intensive care unit: a hybrid neural network approach","Baker S, Xiang W, Atkinson I.","Sci Rep. 2020 Dec 4;10(1):21282. doi: 10.1038/s41598-020-78184-7.","Baker S","Sci Rep","2020","2020/12/05","PMC7718228","","10.1038/s41598-020-78184-7"
"33273655","Association between red blood cell distribution width and long-term mortality in acute respiratory failure patients","Zhang W, Wang Y, Wang J, Wang S.","Sci Rep. 2020 Dec 3;10(1):21185. doi: 10.1038/s41598-020-78321-2.","Zhang W","Sci Rep","2020","2020/12/04","PMC7713121","","10.1038/s41598-020-78321-2"
"33270030","Unpacking Prevalence and Dichotomy in Quick Sequential Organ Failure Assessment and Systemic Inflammatory Response Syndrome Parameters: Observational Data-Driven Approach Backed by Sepsis Pathophysiology","Sakib N, Ahamed SI, Khan RA, Griffin PM, Haque MM.","JMIR Med Inform. 2020 Dec 3;8(12):e18352. doi: 10.2196/18352.","Sakib N","JMIR Med Inform","2020","2020/12/03","PMC7746497","","10.2196/18352"
"33262391","Predicting the need for intubation in the first 24 h after critical care admission using machine learning approaches","Siu BMK, Kwak GH, Ling L, Hui P.","Sci Rep. 2020 Dec 1;10(1):20931. doi: 10.1038/s41598-020-77893-3.","Siu BMK","Sci Rep","2020","2020/12/02","PMC7708470","","10.1038/s41598-020-77893-3"
"33259943","Pre-training phenotyping classifiers","Dligach D, Afshar M, Miller T.","J Biomed Inform. 2021 Jan;113:103626. doi: 10.1016/j.jbi.2020.103626. Epub 2020 Nov 28.","Dligach D","J Biomed Inform","2021","2020/12/01","PMC7856089","NIHMS1652576","10.1016/j.jbi.2020.103626"
"33250149","Prediction of breast cancer distant recurrence using natural language processing and knowledge-guided convolutional neural network","Wang H, Li Y, Khan SA, Luo Y.","Artif Intell Med. 2020 Nov;110:101977. doi: 10.1016/j.artmed.2020.101977. Epub 2020 Nov 1.","Wang H","Artif Intell Med","2020","2020/11/30","PMC7983067","NIHMS1644755","10.1016/j.artmed.2020.101977"
"33245284","Identification of Semantically Similar Sentences in Clinical Notes: Iterative Intermediate Training Using Multi-Task Learning","Mahajan D, Poddar A, Liang JJ, Lin YT, Prager JM, Suryanarayanan P, Raghavan P, Tsou CH.","JMIR Med Inform. 2020 Nov 27;8(11):e22508. doi: 10.2196/22508.","Mahajan D","JMIR Med Inform","2020","2020/11/27","PMC7732709","","10.2196/22508"
"33245283","Predicting Unplanned Readmissions Following a Hip or Knee Arthroplasty: Retrospective Observational Study","Mohammadi R, Jain S, Namin AT, Scholem Heller M, Palacholla R, Kamarthi S, Wallace B.","JMIR Med Inform. 2020 Nov 27;8(11):e19761. doi: 10.2196/19761.","Mohammadi R","JMIR Med Inform","2020","2020/11/27","PMC7732713","","10.2196/19761"
"33242115","[What is new… Implementation of artificial intelligence in intensive care medicine : Hype or already reality?]","Martin L, Peine A.","Anaesthesist. 2021 Jan;70(1):40-41. doi: 10.1007/s00101-020-00891-7.","Martin L","Anaesthesist","2021","2020/11/26","","","10.1007/s00101-020-00891-7"
"33234161","Prediction of hypotension events with physiologic vital sign signatures in the intensive care unit","Yoon JH, Jeanselme V, Dubrawski A, Hravnak M, Pinsky MR, Clermont G.","Crit Care. 2020 Nov 25;24(1):661. doi: 10.1186/s13054-020-03379-3.","Yoon JH","Crit Care","2020","2020/11/25","PMC7687996","","10.1186/s13054-020-03379-3"
"33233029","Effects of etomidate use in ICU patients on ventilator therapy: a study of 12,526 patients in an open database from a single center","Park HY, Lee Y, Lim CY, Kim M, Park J, Lee T.","Korean J Anesthesiol. 2021 Aug;74(4):300-307. doi: 10.4097/kja.20509. Epub 2020 Nov 25.","Park HY","Korean J Anesthesiol","2021","2020/11/24","PMC8342844","","10.4097/kja.20509"
"33226350","Measurement of Semantic Textual Similarity in Clinical Texts: Comparison of Transformer-Based Models","Yang X, He X, Zhang H, Ma Y, Bian J, Wu Y.","JMIR Med Inform. 2020 Nov 23;8(11):e19735. doi: 10.2196/19735.","Yang X","JMIR Med Inform","2020","2020/11/23","PMC7721552","","10.2196/19735"
"33225302","Development and Verification of a Digital Twin Patient Model to Predict Specific Treatment Response During the First 24 Hours of Sepsis","Lal A, Li G, Cubro E, Chalmers S, Li H, Herasevich V, Dong Y, Pickering BW, Kilickaya O, Gajic O.","Crit Care Explor. 2020 Nov 16;2(11):e0249. doi: 10.1097/CCE.0000000000000249. eCollection 2020 Nov.","Lal A","Crit Care Explor","2020","2020/11/23","PMC7671877","","10.1097/CCE.0000000000000249"
"33224967","PPGSynth: An Innovative Toolbox for Synthesizing Regular and Irregular Photoplethysmography Waveforms","Tang Q, Chen Z, Allen J, Alian A, Menon C, Ward R, Elgendi M.","Front Med (Lausanne). 2020 Nov 2;7:597774. doi: 10.3389/fmed.2020.597774. eCollection 2020.","Tang Q","Front Med (Lausanne)","2020","2020/11/23","PMC7668389","","10.3389/fmed.2020.597774"
"33220494","An empirical characterization of fair machine learning for clinical risk prediction","Pfohl SR, Foryciarz A, Shah NH.","J Biomed Inform. 2021 Jan;113:103621. doi: 10.1016/j.jbi.2020.103621. Epub 2020 Nov 18.","Pfohl SR","J Biomed Inform","2021","2020/11/21","PMC7871979","NIHMS1661046","10.1016/j.jbi.2020.103621"
"33218084","Vital Signs Prediction and Early Warning Score Calculation Based on Continuous Monitoring of Hospitalised Patients Using Wearable Technology","Youssef Ali Amer A, Wouters F, Vranken J, de Korte-de Boer D, Smit-Fun V, Duflot P, Beaupain MH, Vandervoort P, Luca S, Aerts JM, Vanrumste B.","Sensors (Basel). 2020 Nov 18;20(22):6593. doi: 10.3390/s20226593.","Youssef Ali Amer A","Sensors (Basel)","2020","2020/11/21","PMC7698871","","10.3390/s20226593"
"33215074","Evaluation of patient-level retrieval from electronic health record data for a cohort discovery task","Chamberlin SR, Bedrick SD, Cohen AM, Wang Y, Wen A, Liu S, Liu H, Hersh WR.","JAMIA Open. 2020 Jul 26;3(3):395-404. doi: 10.1093/jamiaopen/ooaa026. eCollection 2020 Oct.","Chamberlin SR","JAMIA Open","2020","2020/11/20","PMC7660955","","10.1093/jamiaopen/ooaa026"
"33205130","The Veterans Affairs Precision Oncology Data Repository, a Clinical, Genomic, and Imaging Research Database","Elbers DC, Fillmore NR, Sung FC, Ganas SS, Prokhorenkov A, Meyer C, Hall RB, Ajjarapu SJ, Chen DC, Meng F, Grossman RL, Brophy MT, Do NV.","Patterns (N Y). 2020 Aug 17;1(6):100083. doi: 10.1016/j.patter.2020.100083. eCollection 2020 Sep 11.","Elbers DC","Patterns (N Y)","2020","2020/11/18","PMC7660389","","10.1016/j.patter.2020.100083"
"33204939","Federated Learning for Healthcare Informatics","Xu J, Glicksberg BS, Su C, Walker P, Bian J, Wang F.","J Healthc Inform Res. 2021;5(1):1-19. doi: 10.1007/s41666-020-00082-4. Epub 2020 Nov 12.","Xu J","J Healthc Inform Res","2021","2020/11/18","PMC7659898","","10.1007/s41666-020-00082-4"
"33204501","Artificial intelligence in orthopaedics: false hope or not? A narrative review along the line of Gartner's hype cycle","Oosterhoff JHF, Doornberg JN; Machine Learning Consortium.","EFORT Open Rev. 2020 Oct 26;5(10):593-603. doi: 10.1302/2058-5241.5.190092. eCollection 2020 Oct.","Oosterhoff JHF","EFORT Open Rev","2020","2020/11/18","PMC7608572","","10.1302/2058-5241.5.190092"
"33195354","Prognostic Role of Ammonia in Critical Care Patients Without Known Hepatic Disease","Zhao L, Walline JH, Gao Y, Lu X, Yu S, Ge Z, Zhu H, Li Y.","Front Med (Lausanne). 2020 Oct 22;7:589825. doi: 10.3389/fmed.2020.589825. eCollection 2020.","Zhao L","Front Med (Lausanne)","2020","2020/11/16","PMC7642587","","10.3389/fmed.2020.589825"
"33182703","Facilitating the Development of Deep Learning Models with Visual Analytics for Electronic Health Records","Hur C, Wi J, Kim Y.","Int J Environ Res Public Health. 2020 Nov 10;17(22):8303. doi: 10.3390/ijerph17228303.","Hur C","Int J Environ Res Public Health","2020","2020/11/13","PMC7697823","","10.3390/ijerph17228303"
"33164082","Informative presence and observation in routine health data: A review of methodology for clinical risk prediction","Sisk R, Lin L, Sperrin M, Barrett JK, Tom B, Diaz-Ordaz K, Peek N, Martin GP.","J Am Med Inform Assoc. 2021 Jan 15;28(1):155-166. doi: 10.1093/jamia/ocaa242.","Sisk R","J Am Med Inform Assoc","2021","2020/11/09","PMC7810439","","10.1093/jamia/ocaa242"
"33162796","Deceased serum bilirubin and albumin levels in the assessment of severity and mortality in patients with acute pancreatitis","Xu X, Ai F, Huang M.","Int J Med Sci. 2020 Sep 23;17(17):2685-2695. doi: 10.7150/ijms.49606. eCollection 2020.","Xu X","Int J Med Sci","2020","2020/11/09","PMC7645339","","10.7150/ijms.49606"
"33157998","Platelets as a prognostic marker for sepsis: A cohort study from the MIMIC-III database","Zhao L, Zhao L, Wang YY, Yang F, Chen Z, Yu Q, Shi H, Huang S, Zhao X, Xiu L, Li X, Li Y.","Medicine (Baltimore). 2020 Nov 6;99(45):e23151. doi: 10.1097/MD.0000000000023151.","Zhao L","Medicine (Baltimore)","2020","2020/11/07","PMC7647525","","10.1097/MD.0000000000023151"
"33151150","Amplifying Domain Expertise in Clinical Data Pipelines","Rahman P, Nandi A, Hebert C.","JMIR Med Inform. 2020 Nov 5;8(11):e19612. doi: 10.2196/19612.","Rahman P","JMIR Med Inform","2020","2020/11/05","PMC7677017","","10.2196/19612"
"33149568","Impacts of Comorbid Chronic Obstructive Pulmonary Disease and Congestive Heart Failure on Prognosis of Critically Ill Patients","Dai Y, Qin S, Pan H, Chen T, Bian D.","Int J Chron Obstruct Pulmon Dis. 2020 Oct 28;15:2707-2714. doi: 10.2147/COPD.S275573. eCollection 2020.","Dai Y","Int J Chron Obstruct Pulmon Dis","2020","2020/11/05","PMC7604246","","10.2147/COPD.S275573"
"33139965","Classifying Electronic Consults for Triage Status and Question Type","Ding X, Barnett ML, Mehrotra A, Miller TA.","Proc Conf Assoc Comput Linguist Meet. 2020 Jul;2020:1-6. doi: 10.18653/v1/2020.nlpmc-1.1.","Ding X","Proc Conf Assoc Comput Linguist Meet","2020","2020/11/03","PMC7603636","NIHMS1640423","10.18653/v1/2020.nlpmc-1.1"
"33133877","Noise Detection in Electrocardiogram Signals for Intensive Care Unit Patients","Bashar SK, Ding E, Walkey AJ, McManus DD, Chon KH.","IEEE Access. 2019;7:88357-88368. doi: 10.1109/access.2019.2926199. Epub 2019 Jul 1.","Bashar SK","IEEE Access","2019","2020/11/02","PMC7597656","NIHMS1535204","10.1109/access.2019.2926199"
"33123579","Association between Body Mass Index and Short-Term Clinical Outcomes in Critically Ill Patients with Sepsis: A Real-World Study","Lin S, Ge S, He W, Zeng M.","Biomed Res Int. 2020 Oct 15;2020:5781913. doi: 10.1155/2020/5781913. eCollection 2020.","Lin S","Biomed Res Int","2020","2020/10/30","PMC7584974","","10.1155/2020/5781913"
"33121479","Combining structured and unstructured data for predictive models: a deep learning approach","Zhang D, Yin C, Zeng J, Yuan X, Zhang P.","BMC Med Inform Decis Mak. 2020 Oct 29;20(1):280. doi: 10.1186/s12911-020-01297-6.","Zhang D","BMC Med Inform Decis Mak","2020","2020/10/30","PMC7596962","","10.1186/s12911-020-01297-6"
"33120431","Clinical concept extraction using transformers","Yang X, Bian J, Hogan WR, Wu Y.","J Am Med Inform Assoc. 2020 Dec 9;27(12):1935-1942. doi: 10.1093/jamia/ocaa189.","Yang X","J Am Med Inform Assoc","2020","2020/10/29","PMC7727351","","10.1093/jamia/ocaa189"
"33116549","The Association of Red Blood Cell Distribution Width to Platelet Count Ratio and 28-Day Mortality of Patients with Sepsis: A Retrospective Cohort Study","Ge S, Lin S, Zhang L, Zeng M.","Ther Clin Risk Manag. 2020 Oct 19;16:999-1006. doi: 10.2147/TCRM.S268523. eCollection 2020.","Ge S","Ther Clin Risk Manag","2020","2020/10/29","PMC7586012","","10.2147/TCRM.S268523"
"33106798","Agile clinical research: A data science approach to scrumban in clinical medicine","Lei H, O'Connell R, Ehwerhemuepha L, Taraman S, Feaster W, Chang A.","Intell Based Med. 2020 Dec;3:100009. doi: 10.1016/j.ibmed.2020.100009. Epub 2020 Oct 22.","Lei H","Intell Based Med","2020","2020/10/27","PMC7578702","","10.1016/j.ibmed.2020.100009"
"33101768","DeepConsensus: Consensus-based Interpretable Deep Neural Networks with Application to Mortality Prediction","Salman S, Payrovnaziri SN, Liu X, Rengifo-Moreno P, He Z.","Proc Int Jt Conf Neural Netw. 2020 Jul;2020:10.1109/ijcnn48605.2020.9206678. doi: 10.1109/ijcnn48605.2020.9206678. Epub 2020 Sep 28.","Salman S","Proc Int Jt Conf Neural Netw","2020","2020/10/26","PMC7583142","NIHMS1634785","10.1109/ijcnn48605.2020.9206678"
"33091829","Automatic classification of scanned electronic health record documents","Goodrum H, Roberts K, Bernstam EV.","Int J Med Inform. 2020 Dec;144:104302. doi: 10.1016/j.ijmedinf.2020.104302. Epub 2020 Oct 17.","Goodrum H","Int J Med Inform","2020","2020/10/22","PMC7731898","NIHMS1640997","10.1016/j.ijmedinf.2020.104302"
"33090117","A Racially Unbiased, Machine Learning Approach to Prediction of Mortality: Algorithm Development Study","Allen A, Mataraso S, Siefkas A, Burdick H, Braden G, Dellinger RP, McCoy A, Pellegrini E, Hoffman J, Green-Saxena A, Barnes G, Calvert J, Das R.","JMIR Public Health Surveill. 2020 Oct 22;6(4):e22400. doi: 10.2196/22400.","Allen A","JMIR Public Health Surveill","2020","2020/10/22","PMC7644374","","10.2196/22400"
"33084589","AutoScore: A Machine Learning-Based Automatic Clinical Score Generator and Its Application to Mortality Prediction Using Electronic Health Records","Xie F, Chakraborty B, Ong MEH, Goldstein BA, Liu N.","JMIR Med Inform. 2020 Oct 21;8(10):e21798. doi: 10.2196/21798.","Xie F","JMIR Med Inform","2020","2020/10/21","PMC7641783","","10.2196/21798"
"33077569","Association between neutrophil-to-albumin ratio and mortality in patients with cardiogenic shock: a retrospective cohort study","Peng Y, Xue Y, Wang J, Xiang H, Ji K, Wang J, Lin C.","BMJ Open. 2020 Oct 19;10(10):e039860. doi: 10.1136/bmjopen-2020-039860.","Peng Y","BMJ Open","2020","2020/10/20","PMC7574943","","10.1136/bmjopen-2020-039860"
"33067833","Red Blood Cell Distribution Width as a Predictor of 28-Day Mortality in Critically Ill Patients With Alcohol Use Disorder","Liao L, Pinhu L.","Alcohol Clin Exp Res. 2020 Dec;44(12):2555-2560. doi: 10.1111/acer.14483. Epub 2020 Nov 16.","Liao L","Alcohol Clin Exp Res","2020","2020/10/17","PMC7756313","","10.1111/acer.14483"
"33051513","Survival prediction of patients with sepsis from age, sex, and septic episode number alone","Chicco D, Jurman G.","Sci Rep. 2020 Oct 13;10(1):17156. doi: 10.1038/s41598-020-73558-3.","Chicco D","Sci Rep","2020","2020/10/14","PMC7555553","","10.1038/s41598-020-73558-3"
"33050399","Classification of Biomedical Texts for Cardiovascular Diseases with Deep Neural Network Using a Weighted Feature Representation Method","Ahmed N, Dilmaç F, Alpkocak A.","Healthcare (Basel). 2020 Oct 10;8(4):392. doi: 10.3390/healthcare8040392.","Ahmed N","Healthcare (Basel)","2020","2020/10/14","PMC7712354","","10.3390/healthcare8040392"
"33043264","Seeking predictors for paroxysmal atrial fibrillation in stroke with an online clinical database","Erdener SE.","North Clin Istanb. 2019 Dec 5;7(4):378-385. doi: 10.14744/nci.2019.91668. eCollection 2020.","Erdener SE","North Clin Istanb","2019","2020/10/12","PMC7521092","","10.14744/nci.2019.91668"
"33042536","Mortality prediction model for the triage of COVID-19, pneumonia, and mechanically ventilated ICU patients: A retrospective study","Ryan L, Lam C, Mataraso S, Allen A, Green-Saxena A, Pellegrini E, Hoffman J, Barton C, McCoy A, Das R.","Ann Med Surg (Lond). 2020 Nov;59:207-216. doi: 10.1016/j.amsu.2020.09.044. Epub 2020 Oct 3.","Ryan L","Ann Med Surg (Lond)","2020","2020/10/12","PMC7532803","","10.1016/j.amsu.2020.09.044"
"33040151","Democratizing EHR analyses with FIDDLE: a flexible data-driven preprocessing pipeline for structured clinical data","Tang S, Davarmanesh P, Song Y, Koutra D, Sjoding MW, Wiens J.","J Am Med Inform Assoc. 2020 Dec 9;27(12):1921-1934. doi: 10.1093/jamia/ocaa139.","Tang S","J Am Med Inform Assoc","2020","2020/10/11","PMC7727385","","10.1093/jamia/ocaa139"
"33034642","Comparison of Chest Radiograph Interpretations by Artificial Intelligence Algorithm vs Radiology Residents","Wu JT, Wong KCL, Gur Y, Ansari N, Karargyris A, Sharma A, Morris M, Saboury B, Ahmad H, Boyko O, Syed A, Jadhav A, Wang H, Pillai A, Kashyap S, Moradi M, Syeda-Mahmood T.","JAMA Netw Open. 2020 Oct 1;3(10):e2022779. doi: 10.1001/jamanetworkopen.2020.22779.","Wu JT","JAMA Netw Open","2020","2020/10/09","PMC7547369","","10.1001/jamanetworkopen.2020.22779"
"33031455","Rapid declines in systolic blood pressure are associated with an increase in pulse transit time","Schaanning SG, Skjaervold NK.","PLoS One. 2020 Oct 8;15(10):e0240126. doi: 10.1371/journal.pone.0240126. eCollection 2020.","Schaanning SG","PLoS One","2020","2020/10/08","PMC7544103","","10.1371/journal.pone.0240126"
"33029642","Clinical concept normalization with a hybrid natural language processing system combining multilevel matching and machine learning ranking","Chen L, Fu W, Gu Y, Sun Z, Li H, Li E, Jiang L, Gao Y, Huang Y.","J Am Med Inform Assoc. 2020 Oct 1;27(10):1576-1584. doi: 10.1093/jamia/ocaa155.","Chen L","J Am Med Inform Assoc","2020","2020/10/08","PMC7647369","","10.1093/jamia/ocaa155"
"33028000","Premature Atrial and Ventricular Contraction Detection using Photoplethysmographic Data from a Smartwatch","Han D, Bashar SK, Mohagheghian F, Ding E, Whitcomb C, McManus DD, Chon KH.","Sensors (Basel). 2020 Oct 5;20(19):5683. doi: 10.3390/s20195683.","Han D","Sensors (Basel)","2020","2020/10/08","PMC7582300","","10.3390/s20195683"
"33019215","Predicting Mortality in Critical Care Patients with Fungemia Using Structured and Unstructured Data","Baxter SL, Klie AR, Saseendrakumar BR, Ye GY, Hogarth M, Nemati S.","Annu Int Conf IEEE Eng Med Biol Soc. 2020 Jul;2020:5459-5463. doi: 10.1109/EMBC44109.2020.9175287.","Baxter SL","Annu Int Conf IEEE Eng Med Biol Soc","2020","2020/10/06","PMC7709796","NIHMS1644141","10.1109/EMBC44109.2020.9175287"
"33010425","Multi-Ontology Refined Embeddings (MORE): A hybrid multi-ontology and corpus-based semantic representation model for biomedical concepts","Jiang S, Wu W, Tomita N, Ganoe C, Hassanpour S.","J Biomed Inform. 2020 Nov;111:103581. doi: 10.1016/j.jbi.2020.103581. Epub 2020 Oct 1.","Jiang S","J Biomed Inform","2020","2020/10/03","PMC7665985","NIHMS1635279","10.1016/j.jbi.2020.103581"
