PMID,Title,Authors,Citation,First Author,Journal/Book,Publication Year,Create Date,PMCID,NIHMS ID,DOI
"36253581","Event-Based Clinical Finding Extraction from Radiology Reports with Pre-trained Language Model","Lau W, Lybarger K, Gunn ML, Yetisgen M.","J Digit Imaging. 2023 Feb;36(1):91-104. doi: 10.1007/s10278-022-00717-5. Epub 2022 Oct 17.","Lau W","J Digit Imaging","2023","2022/10/17","PMC9576130","","10.1007/s10278-022-00717-5"
"36253030","Natural Language Processing in Nephrology","Van Vleck TT, Farrell D, Chan L.","Adv Chronic Kidney Dis. 2022 Sep;29(5):465-471. doi: 10.1053/j.ackd.2022.07.001.","Van Vleck TT","Adv Chronic Kidney Dis","2022","2022/10/17","PMC9586467","NIHMS1831944","10.1053/j.ackd.2022.07.001"
"36253026","Machine Learning for Acute Kidney Injury Prediction in the Intensive Care Unit","Gottlieb ER, Samuel M, Bonventre JV, Celi LA, Mattie H.","Adv Chronic Kidney Dis. 2022 Sep;29(5):431-438. doi: 10.1053/j.ackd.2022.06.005.","Gottlieb ER","Adv Chronic Kidney Dis","2022","2022/10/17","PMC9586459","NIHMS1819139","10.1053/j.ackd.2022.06.005"
"36251539","U-shaped association between body mass index and ejection fraction in intensive care unit patients with heart failure","Liu H, Huang Y, Zhuo W, Wan R, Hong K.","ESC Heart Fail. 2023 Feb;10(1):377-384. doi: 10.1002/ehf2.14198. Epub 2022 Oct 17.","Liu H","ESC Heart Fail","2023","2022/10/17","PMC9871715","","10.1002/ehf2.14198"
"36251369","Standardized Description of the Feature Extraction Process to Transform Raw Data Into Meaningful Information for Enhancing Data Reuse: Consensus Study","Lamer A, Fruchart M, Paris N, Popoff B, Payen A, Balcaen T, Gacquer W, Bouzillé G, Cuggia M, Doutreligne M, Chazard E.","JMIR Med Inform. 2022 Oct 17;10(10):e38936. doi: 10.2196/38936.","Lamer A","JMIR Med Inform","2022","2022/10/17","PMC9623460","","10.2196/38936"
"36250540","Predicting medical events and ICU requirements using a multimodal multiobjective transformer network","Jana S, Dasgupta T, Dey L.","Exp Biol Med (Maywood). 2022 Nov;247(22):1988-2002. doi: 10.1177/15353702221126559. Epub 2022 Oct 16.","Jana S","Exp Biol Med (Maywood)","2022","2022/10/17","PMC9791303","","10.1177/15353702221126559"
"36247784","Increased variability of mean arterial pressure is associated with increased risk of short-term mortality in intensive care unit: A retrospective study","Yao J, Liu D, Huang W, Fang Y, Yang Y, Li Y, Liu P, Pan X.","Front Neurol. 2022 Sep 29;13:999540. doi: 10.3389/fneur.2022.999540. eCollection 2022.","Yao J","Front Neurol","2022","2022/10/17","PMC9557059","","10.3389/fneur.2022.999540"
"36246480","Venous thromboembolism in critically ill patients with pneumonia in the pre-COVID-19 era: Data from a large public database","Pisani M, Orsi FA, Annichino-Bizzacchi JM, Barco S, De Paula EV.","Res Pract Thromb Haemost. 2022 Oct 9;6(7):e12816. doi: 10.1002/rth2.12816. eCollection 2022 Oct.","Pisani M","Res Pract Thromb Haemost","2022","2022/10/17","PMC9548411","","10.1002/rth2.12816"
"36246101","Support vector machine deep mining of electronic medical records to predict the prognosis of severe acute myocardial infarction","Zhou X, Li X, Zhang Z, Han Q, Deng H, Jiang Y, Tang C, Yang L.","Front Physiol. 2022 Sep 29;13:991990. doi: 10.3389/fphys.2022.991990. eCollection 2022.","Zhou X","Front Physiol","2022","2022/10/17","PMC9558165","","10.3389/fphys.2022.991990"
"36241976","DeepMPM: a mortality risk prediction model using longitudinal EHR data","Yang F, Zhang J, Chen W, Lai Y, Wang Y, Zou Q.","BMC Bioinformatics. 2022 Oct 14;23(1):423. doi: 10.1186/s12859-022-04975-6.","Yang F","BMC Bioinformatics","2022","2022/10/14","PMC9561325","","10.1186/s12859-022-04975-6"
"36240002","Identifying Patients With Heart Failure Who Are Susceptible to De Novo Acute Kidney Injury: Machine Learning Approach","Hong C, Sun Z, Hao Y, Dong Z, Gu Z, Huang Z.","JMIR Med Inform. 2022 Oct 14;10(10):e37484. doi: 10.2196/37484.","Hong C","JMIR Med Inform","2022","2022/10/14","PMC9617187","","10.2196/37484"
"36231682","Chronic Kidney Disease as a Cardiovascular Disorder-Tonometry Data Analyses","Twardawa M, Formanowicz P, Formanowicz D.","Int J Environ Res Public Health. 2022 Sep 28;19(19):12339. doi: 10.3390/ijerph191912339.","Twardawa M","Int J Environ Res Public Health","2022","2022/10/14","PMC9566812","","10.3390/ijerph191912339"
"36224308","Prediction of persistent acute kidney injury in postoperative intensive care unit patients using integrated machine learning: a retrospective cohort study","Jiang X, Hu Y, Guo S, Du C, Cheng X.","Sci Rep. 2022 Oct 12;12(1):17134. doi: 10.1038/s41598-022-21428-5.","Jiang X","Sci Rep","2022","2022/10/12","PMC9556643","","10.1038/s41598-022-21428-5"
"36218161","Donepezil treatment is associated with improved outcomes in critically ill dementia patients via a reduction in delirium","Lieberman OJ, Lee S, Zabinski J.","Alzheimers Dement. 2023 May;19(5):1742-1751. doi: 10.1002/alz.12807. Epub 2022 Oct 11.","Lieberman OJ","Alzheimers Dement","2023","2022/10/11","PMC10483393","NIHMS1925208","10.1002/alz.12807"
"36217914","Phenotyping in clinical text with unsupervised numerical reasoning for patient stratification","Tanwar A, Zhang J, Ive J, Gupta V, Guo Y.","Exp Biol Med (Maywood). 2022 Nov;247(22):2038-2052. doi: 10.1177/15353702221118092. Epub 2022 Oct 11.","Tanwar A","Exp Biol Med (Maywood)","2022","2022/10/11","PMC9791305","","10.1177/15353702221118092"
"36217389","Advances in Cuffless Continuous Blood Pressure Monitoring Technology Based on PPG Signals","Qin C, Wang X, Xu G, Ma X.","Biomed Res Int. 2022 Oct 1;2022:8094351. doi: 10.1155/2022/8094351. eCollection 2022.","Qin C","Biomed Res Int","2022","2022/10/11","PMC9547685","","10.1155/2022/8094351"
"36203150","Red blood cell distribution width predicts gastrointestinal bleeding after coronary artery bypass grafting","Liao Y, Zhang R, Shi S, Lin X, Wang Y, Wang Y, Chen W, Zhao Y, Bao K, Zhang K, Chen L, Fang Y.","BMC Cardiovasc Disord. 2022 Oct 6;22(1):436. doi: 10.1186/s12872-022-02875-4.","Liao Y","BMC Cardiovasc Disord","2022","2022/10/06","PMC9540710","","10.1186/s12872-022-02875-4"
"36193558","Association between serum sodium level trajectories and survival in patients with heart failure","Xia YM, Wang S, Wu WD, Liang JF.","ESC Heart Fail. 2023 Feb;10(1):255-263. doi: 10.1002/ehf2.14187. Epub 2022 Oct 3.","Xia YM","ESC Heart Fail","2023","2022/10/04","PMC9871655","","10.1002/ehf2.14187"
"36187634","Current status and trends in researches based on public intensive care databases: A scientometric investigation","Li M, Du S.","Front Public Health. 2022 Sep 15;10:912151. doi: 10.3389/fpubh.2022.912151. eCollection 2022.","Li M","Front Public Health","2022","2022/10/03","PMC9521614","","10.3389/fpubh.2022.912151"
"36187010","A retrospective cohort study on the association between early coagulation disorder and short-term all-cause mortality of critically ill patients with congestive heart failure","Tang Y, Chen Q, Liang B, Peng B, Wang M, Sun J, Liu Z, Zha L, Yu Z.","Front Cardiovasc Med. 2022 Sep 16;9:999391. doi: 10.3389/fcvm.2022.999391. eCollection 2022.","Tang Y","Front Cardiovasc Med","2022","2022/10/03","PMC9524154","","10.3389/fcvm.2022.999391"
"36186874","Natural language processing in clinical neuroscience and psychiatry: A review","Crema C, Attardi G, Sartiano D, Redolfi A.","Front Psychiatry. 2022 Sep 14;13:946387. doi: 10.3389/fpsyt.2022.946387. eCollection 2022.","Crema C","Front Psychiatry","2022","2022/10/03","PMC9515453","","10.3389/fpsyt.2022.946387"
"36176552","Dynamic nomogram for predicting acute kidney injury in patients with acute ischemic stroke: A retrospective study","Zhu G, Fu Z, Jin T, Xu X, Wei J, Cai L, Yu W.","Front Neurol. 2022 Sep 13;13:987684. doi: 10.3389/fneur.2022.987684. eCollection 2022.","Zhu G","Front Neurol","2022","2022/09/30","PMC9513523","","10.3389/fneur.2022.987684"
"36176433","Effectiveness of sodium bicarbonate infusion on mortality for elderly septic patients with acute metabolic acidosis","Huang S, Peng Y, Wang L, Wang J, Zhou X, Cui X, Chen L, Yang B, Feng C.","Front Pharmacol. 2022 Sep 13;13:974271. doi: 10.3389/fphar.2022.974271. eCollection 2022.","Huang S","Front Pharmacol","2022","2022/09/30","PMC9513550","","10.3389/fphar.2022.974271"
"36171266","Serum albumin and the short-term mortality in individuals with congestive heart failure in intensive care unit: an analysis of MIMIC","Chao P, Cui X, Wang S, Zhang L, Ma Q, Zhang X.","Sci Rep. 2022 Sep 28;12(1):16251. doi: 10.1038/s41598-022-20600-1.","Chao P","Sci Rep","2022","2022/09/28","PMC9519563","","10.1038/s41598-022-20600-1"
"36168559","A Preliminary Study of Extracting Pulmonary Nodules and Nodule Characteristics from Radiology Reports Using Natural Language Processing","Yang S, Yang X, Lyu T, He X, Braithwaite D, Mehta HJ, Guo Y, Wu Y, Bian J.","IEEE Int Conf Healthc Inform. 2022 Jun;2022:618-619. doi: 10.1109/ichi54592.2022.00125. Epub 2022 Sep 8.","Yang S","IEEE Int Conf Healthc Inform","2022","2022/09/28","PMC9511964","NIHMS1836669","10.1109/ichi54592.2022.00125"
"36168546","Natural Language Processing and Machine Learning to Identify People Who Inject Drugs in Electronic Health Records","Goodman-Meza D, Tang A, Aryanfar B, Vazquez S, Gordon AJ, Goto M, Goetz MB, Shoptaw S, Bui AAT.","Open Forum Infect Dis. 2022 Sep 12;9(9):ofac471. doi: 10.1093/ofid/ofac471. eCollection 2022 Sep.","Goodman-Meza D","Open Forum Infect Dis","2022","2022/09/28","PMC9511274","","10.1093/ofid/ofac471"
"36168325","Activated Partial Thromboplastin Time and Mortality in Coronary Artery Bypass Grafting Patients","Zhang H, Tian W, Qi G, Sun L, Wei X.","Dis Markers. 2022 Sep 17;2022:2918654. doi: 10.1155/2022/2918654. eCollection 2022.","Zhang H","Dis Markers","2022","2022/09/28","PMC9509521","","10.1155/2022/2918654"
"36167551","Identify diabetic retinopathy-related clinical concepts and their attributes using transformer-based natural language processing methods","Yu Z, Yang X, Sweeting GL, Ma Y, Stolte SE, Fang R, Wu Y.","BMC Med Inform Decis Mak. 2022 Sep 27;22(Suppl 3):255. doi: 10.1186/s12911-022-01996-2.","Yu Z","BMC Med Inform Decis Mak","2022","2022/09/27","PMC9513862","","10.1186/s12911-022-01996-2"
"36158815","Predicting acute kidney injury risk in acute myocardial infarction patients: An artificial intelligence model using medical information mart for intensive care databases","Cai D, Xiao T, Zou A, Mao L, Chi B, Wang Y, Wang Q, Ji Y, Sun L.","Front Cardiovasc Med. 2022 Sep 7;9:964894. doi: 10.3389/fcvm.2022.964894. eCollection 2022.","Cai D","Front Cardiovasc Med","2022","2022/09/26","PMC9489917","","10.3389/fcvm.2022.964894"
"36155549","Association between predialysis creatinine and mortality in acute kidney injury patients requiring dialysis","Chang HH, Wu CL, Tsai CC, Chiu PF.","PLoS One. 2022 Sep 26;17(9):e0274883. doi: 10.1371/journal.pone.0274883. eCollection 2022.","Chang HH","PLoS One","2022","2022/09/26","PMC9512211","","10.1371/journal.pone.0274883"
"36151847","Assessing potassium levels in critically ill patients with heart failure: application of a group-based trajectory model","Lin Z, Zheng J, Liu X, Hu X, Fuxian R, Gao D.","ESC Heart Fail. 2023 Feb;10(1):57-65. doi: 10.1002/ehf2.14161. Epub 2022 Sep 24.","Lin Z","ESC Heart Fail","2023","2022/09/24","PMC9871702","","10.1002/ehf2.14161"
"36144060","Evaluating and Visualizing the Contribution of ECG Characteristic Waveforms for PPG-Based Blood Pressure Estimation","Ma G, Chen Y, Zhu W, Zheng L, Tang H, Yu Y, Wang L.","Micromachines (Basel). 2022 Aug 31;13(9):1438. doi: 10.3390/mi13091438.","Ma G","Micromachines (Basel)","2022","2022/09/23","PMC9502729","","10.3390/mi13091438"
"36143144","Artificial Intelligence-Based Medical Data Mining","Zia A, Aziz M, Popa I, Khan SA, Hamedani AF, Asif AR.","J Pers Med. 2022 Aug 24;12(9):1359. doi: 10.3390/jpm12091359.","Zia A","J Pers Med","2022","2022/09/23","PMC9501106","","10.3390/jpm12091359"
"36142936","Predicting Mortality Using Machine Learning Algorithms in Patients Who Require Renal Replacement Therapy in the Critical Care Unit","Chang HH, Chiang JH, Wang CS, Chiu PF, Abdel-Kader K, Chen H, Siew ED, Yabes J, Murugan R, Clermont G, Palevsky PM, Jhamb M.","J Clin Med. 2022 Sep 8;11(18):5289. doi: 10.3390/jcm11185289.","Chang HH","J Clin Med","2022","2022/09/23","PMC9500742","","10.3390/jcm11185289"
"36134327","A Nomogram to Better Predict the In-Hospital Mortality of Trauma Patients with Sepsis in the Intensive Care Unit","Qi J, Xie Q, Li Z, Sun C.","Int J Clin Pract. 2022 Sep 9;2022:4134138. doi: 10.1155/2022/4134138. eCollection 2022.","Qi J","Int J Clin Pract","2022","2022/09/22","PMC9481405","","10.1155/2022/4134138"
"36133909","Construction of a Prediction Model for the Mortality of Elderly Patients with Diabetic Nephropathy","Wang L, Lv Y.","J Healthc Eng. 2022 Sep 12;2022:5724050. doi: 10.1155/2022/5724050. eCollection 2022.","Wang L","J Healthc Eng","2022","2022/09/22","PMC9484980","","10.1155/2022/5724050"
"36127417","Integrated multimodal artificial intelligence framework for healthcare applications","Soenksen LR, Ma Y, Zeng C, Boussioux L, Villalobos Carballo K, Na L, Wiberg HM, Li ML, Fuentes I, Bertsimas D.","NPJ Digit Med. 2022 Sep 20;5(1):149. doi: 10.1038/s41746-022-00689-4.","Soenksen LR","NPJ Digit Med","2022","2022/09/20","PMC9489871","","10.1038/s41746-022-00689-4"
"36121054","An AI based digital-twin for prioritising pneumonia patient treatment","Chakshu NK, Nithiarasu P.","Proc Inst Mech Eng H. 2022 Nov;236(11):1662-1674. doi: 10.1177/09544119221123431. Epub 2022 Sep 18.","Chakshu NK","Proc Inst Mech Eng H","2022","2022/09/19","PMC9647318","","10.1177/09544119221123431"
"36111019","Non-linear relationship between baseline mean arterial pressure and 30-day mortality in patients with sepsis: a retrospective cohort study based on the MIMIC-III database","Cao B, Chen Q, Tang T, Li H, Zhong X, Hao P, He Q, Chen Y.","Ann Transl Med. 2022 Aug;10(16):872. doi: 10.21037/atm-22-3457.","Cao B","Ann Transl Med","2022","2022/09/16","PMC9469146","","10.21037/atm-22-3457"
"36109635","Multimodal biomedical AI","Acosta JN, Falcone GJ, Rajpurkar P, Topol EJ.","Nat Med. 2022 Sep;28(9):1773-1784. doi: 10.1038/s41591-022-01981-2. Epub 2022 Sep 15.","Acosta JN","Nat Med","2022","2022/09/15","","","10.1038/s41591-022-01981-2"
"36101663","Deconfounding Actor-Critic Network with Policy Adaptation for Dynamic Treatment Regimes","Yin C, Liu R, Caterino J, Zhang P.","KDD. 2022 Aug;2022:2316-2326. doi: 10.1145/3534678.3539413. Epub 2022 Aug 13.","Yin C","KDD","2022","2022/09/14","PMC9466407","NIHMS1830314","10.1145/3534678.3539413"
"36093166","An artificial intelligence-based noninvasive solution to estimate pulmonary artery pressure","Zheng J, Abudayyeh I, Mladenov G, Struppa D, Fu G, Chu H, Rakovski C.","Front Cardiovasc Med. 2022 Aug 24;9:855356. doi: 10.3389/fcvm.2022.855356. eCollection 2022.","Zheng J","Front Cardiovasc Med","2022","2022/09/12","PMC9448961","","10.3389/fcvm.2022.855356"
"36092768","Knowledge Distillation via Constrained Variational Inference","Saeedi A, Utsumi Y, Sun L, Batmanghelich K, Lehman LH.","Proc AAAI Conf Artif Intell. 2022 Feb-Mar;36(7):8132-8140. doi: 10.1609/aaai.v36i7.20786. Epub 2022 Jun 28.","Saeedi A","Proc AAAI Conf Artif Intell","2022","2022/09/12","PMC9455583","NIHMS1778851","10.1609/aaai.v36i7.20786"
"36089199","FHIR-Ontop-OMOP: Building clinical knowledge graphs in FHIR RDF with the OMOP Common data Model","Xiao G, Pfaff E, Prud'hommeaux E, Booth D, Sharma DK, Huo N, Yu Y, Zong N, Ruddy KJ, Chute CG, Jiang G.","J Biomed Inform. 2022 Oct;134:104201. doi: 10.1016/j.jbi.2022.104201. Epub 2022 Sep 9.","Xiao G","J Biomed Inform","2022","2022/09/11","PMC9561043","NIHMS1839711","10.1016/j.jbi.2022.104201"
"36088306","Impact of lactate dehydrogenase on prognosis of patients undergoing cardiac surgery","Zeng Y, Zhao Y, Dai S, Liu Y, Zhang R, Yan H, Zhao M, Wang Y.","BMC Cardiovasc Disord. 2022 Sep 10;22(1):404. doi: 10.1186/s12872-022-02848-7.","Zeng Y","BMC Cardiovasc Disord","2022","2022/09/10","PMC9463775","","10.1186/s12872-022-02848-7"
"36082375","Prediction of Inhospital Mortality in Critically Ill Patients With Sepsis: Confirmation of the Added Value of 24-Hour Lactate to Acute Physiology and Chronic Health Evaluation IV","Baysan M, Arbous MS, Steyerberg EW, van der Bom JG.","Crit Care Explor. 2022 Sep 2;4(9):e0750. doi: 10.1097/CCE.0000000000000750. eCollection 2022 Sep.","Baysan M","Crit Care Explor","2022","2022/09/09","PMC9444407","","10.1097/CCE.0000000000000750"
"36072611","The Association of Renin-Angiotensin System Blockades and Mortality in Patients with Acute Exacerbation of Chronic Obstructive Pulmonary Disease and Acute Respiratory Failure: A Retrospective Cohort Study","Ruan Z, Li D, Hu Y, Qiu Z, Chen X.","Int J Chron Obstruct Pulmon Dis. 2022 Sep 1;17:2001-2011. doi: 10.2147/COPD.S370817. eCollection 2022.","Ruan Z","Int J Chron Obstruct Pulmon Dis","2022","2022/09/08","PMC9444000","","10.2147/COPD.S370817"
"36060541","Timing errors and temporal uncertainty in clinical databases-A narrative review","Goodwin AJ, Eytan D, Dixon W, Goodfellow SD, Doherty Z, Greer RW, McEwan A, Tracy M, Laussen PC, Assadi A, Mazwi M.","Front Digit Health. 2022 Aug 18;4:932599. doi: 10.3389/fdgth.2022.932599. eCollection 2022.","Goodwin AJ","Front Digit Health","2022","2022/09/05","PMC9433547","","10.3389/fdgth.2022.932599"
"36059892","Subpopulation-specific machine learning prognosis for underrepresented patients with double prioritized bias correction","Afrose S, Song W, Nemeroff CB, Lu C, Yao DD.","Commun Med (Lond). 2022 Sep 1;2:111. doi: 10.1038/s43856-022-00165-w. eCollection 2022.","Afrose S","Commun Med (Lond)","2022","2022/09/05","PMC9436942","","10.1038/s43856-022-00165-w"
"36059447","Association of longitudinal platelet count trajectory with ICU mortality: A multi-cohort study","Chen J, Gao X, Shen S, Xu J, Sun Z, Lin R, Dai Z, Su L, Christiani DC, Chen F, Zhang R, Wei Y.","Front Immunol. 2022 Aug 19;13:936662. doi: 10.3389/fimmu.2022.936662. eCollection 2022.","Chen J","Front Immunol","2022","2022/09/05","PMC9437551","","10.3389/fimmu.2022.936662"
"36052315","Computational approaches to alleviate alarm fatigue in intensive care medicine: A systematic literature review","Chromik J, Klopfenstein SAI, Pfitzner B, Sinno ZC, Arnrich B, Balzer F, Poncette AS.","Front Digit Health. 2022 Aug 16;4:843747. doi: 10.3389/fdgth.2022.843747. eCollection 2022.","Chromik J","Front Digit Health","2022","2022/09/02","PMC9424650","","10.3389/fdgth.2022.843747"
"36050787","Challenges and opportunities for mining adverse drug reactions: perspectives from pharma, regulatory agencies, healthcare providers and consumers","Gonzalez-Hernandez G, Krallinger M, Muñoz M, Rodriguez-Esteban R, Uzuner Ö, Hirschman L.","Database (Oxford). 2022 Sep 2;2022:baac071. doi: 10.1093/database/baac071.","Gonzalez-Hernandez G","Database (Oxford)","2022","2022/09/01","PMC9436770","","10.1093/database/baac071"
"36034992","Effect of transthoracic echocardiography on short-term outcomes in patients with acute kidney injury in the intensive care unit: a retrospective cohort study based on the MIMIC-III database","Liu C, Wang S, Wang X.","Ann Transl Med. 2022 Aug;10(15):826. doi: 10.21037/atm-22-3158.","Liu C","Ann Transl Med","2022","2022/08/29","PMC9403917","","10.21037/atm-22-3158"
"36033629","Development and validation of a nomogram to predict the 30-day mortality risk of patients with intracerebral hemorrhage","Zou J, Chen H, Liu C, Cai Z, Yang J, Zhang Y, Li S, Lin H, Tan M.","Front Neurosci. 2022 Aug 10;16:942100. doi: 10.3389/fnins.2022.942100. eCollection 2022.","Zou J","Front Neurosci","2022","2022/08/29","PMC9400715","","10.3389/fnins.2022.942100"
"36028750","External validation of the hospital frailty risk score among older adults receiving mechanical ventilation","Sy E, Kassir S, Mailman JF, Sy SL.","Sci Rep. 2022 Aug 26;12(1):14621. doi: 10.1038/s41598-022-18970-7.","Sy E","Sci Rep","2022","2022/08/26","PMC9418158","","10.1038/s41598-022-18970-7"
"36017092","Base excess is associated with the risk of all-cause mortality in critically ill patients with acute myocardial infarction","Luo C, Duan Z, Zheng T, Li Q, Wang D, Wang B, Gao P, Han D, Tian G.","Front Cardiovasc Med. 2022 Aug 9;9:942485. doi: 10.3389/fcvm.2022.942485. eCollection 2022.","Luo C","Front Cardiovasc Med","2022","2022/08/26","PMC9396255","","10.3389/fcvm.2022.942485"
"36016902","Association Between Wait Time of Central Venous Pressure Measurement and Outcomes in Critical Patients With Acute Kidney Injury: A Retrospective Cohort Study","Yang Q, Chen W, Wen Y, Zheng J, Chen J, Yu S, Chen X, Chen W, Xiong X, Wen D, Zhang Z.","Front Public Health. 2022 Aug 9;10:893683. doi: 10.3389/fpubh.2022.893683. eCollection 2022.","Yang Q","Front Public Health","2022","2022/08/26","PMC9395608","","10.3389/fpubh.2022.893683"
"36015865","Enabling Timely Medical Intervention by Exploring Health-Related Multivariate Time Series with a Hybrid Attentive Model","Xie J, Wang Z, Yu Z, Guo B.","Sensors (Basel). 2022 Aug 15;22(16):6104. doi: 10.3390/s22166104.","Xie J","Sensors (Basel)","2022","2022/08/26","PMC9414519","","10.3390/s22166104"
"36006560","Application of Machine Learning for Clinical Subphenotype Identification in Sepsis","Hu C, Li Y, Wang F, Peng Z.","Infect Dis Ther. 2022 Oct;11(5):1949-1964. doi: 10.1007/s40121-022-00684-y. Epub 2022 Aug 25.","Hu C","Infect Dis Ther","2022","2022/08/25","PMC9617989","","10.1007/s40121-022-00684-y"
"36005051","Real-Time Cuffless Continuous Blood Pressure Estimation Using 1D Squeeze U-Net Model: A Progress toward mHealth","Athaya T, Choi S.","Biosensors (Basel). 2022 Aug 18;12(8):655. doi: 10.3390/bios12080655.","Athaya T","Biosensors (Basel)","2022","2022/08/25","PMC9405546","","10.3390/bios12080655"
"36004994","A Computational Modeling and Simulation Workflow to Investigate the Impact of Patient-Specific and Device Factors on Hemodynamic Measurements from Non-Invasive Photoplethysmography","Fine J, McShane MJ, Coté GL, Scully CG.","Biosensors (Basel). 2022 Aug 4;12(8):598. doi: 10.3390/bios12080598.","Fine J","Biosensors (Basel)","2022","2022/08/25","PMC9405581","","10.3390/bios12080598"
"36001363","Predicting Abnormalities in Laboratory Values of Patients in the Intensive Care Unit Using Different Deep Learning Models: Comparative Study","Ayad A, Hallawa A, Peine A, Martin L, Fazlic LB, Dartmann G, Marx G, Schmeink A.","JMIR Med Inform. 2022 Aug 24;10(8):e37658. doi: 10.2196/37658.","Ayad A","JMIR Med Inform","2022","2022/08/24","PMC9453586","","10.2196/37658"
"35998640","OARD: Open annotations for rare diseases and their phenotypes based on real-world data","Liu C, Ta CN, Havrilla JM, Nestor JG, Spotnitz ME, Geneslaw AS, Hu Y, Chung WK, Wang K, Weng C.","Am J Hum Genet. 2022 Sep 1;109(9):1591-1604. doi: 10.1016/j.ajhg.2022.08.002. Epub 2022 Aug 22.","Liu C","Am J Hum Genet","2022","2022/08/23","PMC9502051","","10.1016/j.ajhg.2022.08.002"
"35984701","Exploiting Missing Value Patterns for a Backdoor Attack on Machine Learning Models of Electronic Health Records: Development and Validation Study","Joe B, Park Y, Hamm J, Shin I, Lee J.","JMIR Med Inform. 2022 Aug 19;10(8):e38440. doi: 10.2196/38440.","Joe B","JMIR Med Inform","2022","2022/08/19","PMC9440413","","10.2196/38440"
"35981230","Identifying the Perceived Severity of Patient-Generated Telemedical Queries Regarding COVID: Developing and Evaluating a Transfer Learning-Based Solution","Gatto J, Seegmiller P, Johnston G, Preum SM.","JMIR Med Inform. 2022 Sep 2;10(9):e37770. doi: 10.2196/37770.","Gatto J","JMIR Med Inform","2022","2022/08/18","PMC9446665","","10.2196/37770"
"35969441","State-of-the-Art Deep Learning Methods on Electrocardiogram Data: Systematic Review","Petmezas G, Stefanopoulos L, Kilintzis V, Tzavelis A, Rogers JA, Katsaggelos AK, Maglaveras N.","JMIR Med Inform. 2022 Aug 15;10(8):e38454. doi: 10.2196/38454.","Petmezas G","JMIR Med Inform","2022","2022/08/15","PMC9425174","","10.2196/38454"
"35957862","A prediction and interpretation machine learning framework of mortality risk among severe infection patients with pseudomonas aeruginosa","Cui C, Mu F, Tang M, Lin R, Wang M, Zhao X, Guan Y, Wang J.","Front Med (Lausanne). 2022 Jul 25;9:942356. doi: 10.3389/fmed.2022.942356. eCollection 2022.","Cui C","Front Med (Lausanne)","2022","2022/08/12","PMC9358029","","10.3389/fmed.2022.942356"
"35946481","Interaction of hemoglobin, transfusion, and acute kidney injury in patients undergoing cardiopulmonary bypass: a group-based trajectory analysis","Cao L, Ru W, Hu C, Shen Y.","Ren Fail. 2022 Dec;44(1):1368-1375. doi: 10.1080/0886022X.2022.2108840.","Cao L","Ren Fail","2022","2022/08/10","PMC9373743","","10.1080/0886022X.2022.2108840"
"35945553","Development and validation of a prognostic nomogram among patients with acute exacerbation of chronic obstructive pulmonary disease in intensive care unit","Peng JC, Gong WW, Wu Y, Yan TY, Jiang XY.","BMC Pulm Med. 2022 Aug 9;22(1):306. doi: 10.1186/s12890-022-02100-0.","Peng JC","BMC Pulm Med","2022","2022/08/09","PMC9364535","","10.1186/s12890-022-02100-0"
"35943079","Artificial Intelligence in Healthcare Competition (TEKNOFEST-2021): Stroke Data Set","Koç U, Akçapınar Sezer E, Özkaya YA, Yarbay Y, Taydaş O, Ayyıldız VA, Kızıloğlu HA, Kesimal U, Çankaya İ, Beşler MS, Karakaş E, Karademir F, Sebik NB, Bahadır M, Sezer Ö, Yeşilyurt B, Varlı S, Akdoğan E, Ülgü MM, Birinci Ş.","Eurasian J Med. 2022 Oct;54(3):248-258. doi: 10.5152/eurasianjmed.2022.22096.","Koç U","Eurasian J Med","2022","2022/08/09","PMC9797774","","10.5152/eurasianjmed.2022.22096"
