PMID,Title,Authors,Citation,First Author,Journal/Book,Publication Year,Create Date,PMCID,NIHMS ID,DOI
"34796719","Natural Language Processing Enhances Prediction of Functional Outcome After Acute Ischemic Stroke","Sung SF, Chen CH, Pan RC, Hu YH, Jeng JS.","J Am Heart Assoc. 2021 Dec 21;10(24):e023486. doi: 10.1161/JAHA.121.023486. Epub 2021 Nov 19.","Sung SF","J Am Heart Assoc","2021","2021/11/19","PMC9075227","","10.1161/JAHA.121.023486"
"34796042","Retaining Privileged Information for Multi-Task Learning","Tang F, Xiao C, Wang F, Zhou J, Lehman LH.","KDD. 2019 Jul;2019:1369-1377. doi: 10.1145/3292500.3330907.","Tang F","KDD","2019","2021/11/19","PMC8596492","NIHMS1751448","10.1145/3292500.3330907"
"34795504","Prognostic Implications of a Cumulative Renal Score Based on Both Serum Creatinine and Urine Output Criteria for Staging of Acute Kidney Injury: A Cohort Study","Ji Y, Li L.","Int J Gen Med. 2021 Nov 8;14:7833-7841. doi: 10.2147/IJGM.S330002. eCollection 2021.","Ji Y","Int J Gen Med","2021","2021/11/19","PMC8593839","","10.2147/IJGM.S330002"
"34790898","Zero-Shot Clinical Acronym Expansion via Latent Meaning Cells","Adams G, Ketenci M, Bhave S, Perotte A, Elhadad N.","Proc Mach Learn Res. 2020 Dec;136:12-40.","Adams G","Proc Mach Learn Res","2020","2021/11/18","PMC8594244","NIHMS1747886",""
"34790710","Preoperative Liver Function Test Abnormalities Were Associated With Short-Term and Long-Term Prognosis in Cardiac Surgery Patients Without Liver Disease","Shang L, Ao Y, Lv L, Lv L, Zhang Y, Hou J, Yao J, Wu Z.","Front Cardiovasc Med. 2021 Nov 1;8:772430. doi: 10.3389/fcvm.2021.772430. eCollection 2021.","Shang L","Front Cardiovasc Med","2021","2021/11/18","PMC8591306","","10.3389/fcvm.2021.772430"
"34789472","Prediction of in-hospital mortality of Clostriodiodes difficile infection using critical care database: a big data-driven, machine learning approach","Du H, Siah KTH, Ru-Yan VZ, Teh R, En Tan CY, Yeung W, Scaduto C, Bolongaita S, Cruz MTK, Liu M, Lin X, Tan YY, Feng M.","BMJ Open Gastroenterol. 2021 Nov;8(1):e000761. doi: 10.1136/bmjgast-2021-000761.","Du H","BMJ Open Gastroenterol","2021","2021/11/18","PMC8601086","","10.1136/bmjgast-2021-000761"
"34789262","Enhancing unsupervised medical entity linking with multi-instance learning","Yan C, Zhang Y, Liu K, Zhao J, Shi Y, Liu S.","BMC Med Inform Decis Mak. 2021 Nov 16;21(Suppl 9):317. doi: 10.1186/s12911-021-01654-z.","Yan C","BMC Med Inform Decis Mak","2021","2021/11/18","PMC8596894","","10.1186/s12911-021-01654-z"
"34789241","An explainable CNN approach for medical codes prediction from clinical text","Hu S, Teng F, Huang L, Yan J, Zhang H.","BMC Med Inform Decis Mak. 2021 Nov 16;21(Suppl 9):256. doi: 10.1186/s12911-021-01615-6.","Hu S","BMC Med Inform Decis Mak","2021","2021/11/18","PMC8596896","","10.1186/s12911-021-01615-6"
"34789238","Drug knowledge discovery via multi-task learning and pre-trained models","Li D, Xiong Y, Hu B, Tang B, Peng W, Chen Q.","BMC Med Inform Decis Mak. 2021 Nov 16;21(Suppl 9):251. doi: 10.1186/s12911-021-01614-7.","Li D","BMC Med Inform Decis Mak","2021","2021/11/18","PMC8596901","","10.1186/s12911-021-01614-7"
"34785944","Association Between the Central Venous Pressure and All-Cause Mortality in Critically Ill Patients with Acute Kidney Injury","Huang A, Liao L, Pan L, Pinhu L.","Int J Gen Med. 2021 Nov 10;14:8019-8027. doi: 10.2147/IJGM.S331686. eCollection 2021.","Huang A","Int J Gen Med","2021","2021/11/17","PMC8590983","","10.2147/IJGM.S331686"
"34778320","Admission Blood Glucose Is Associated With the 30-Days Mortality in Septic Patients: A Retrospective Cohort Study","Wei X, Min Y, Yu J, Wang Q, Wang H, Li S, Su L.","Front Med (Lausanne). 2021 Oct 28;8:757061. doi: 10.3389/fmed.2021.757061. eCollection 2021.","Wei X","Front Med (Lausanne)","2021","2021/11/15","PMC8581133","","10.3389/fmed.2021.757061"
"34778068","Elevated Lactate Dehydrogenase Levels Display a Poor Prognostic Factor for Non-Hodgkin's Lymphoma in Intensive Care Unit: An Analysis of the MIMIC-III Database Combined With External Validation","Qi J, Gu C, Wang W, Xiang M, Chen X, Fu J.","Front Oncol. 2021 Oct 28;11:753712. doi: 10.3389/fonc.2021.753712. eCollection 2021.","Qi J","Front Oncol","2021","2021/11/15","PMC8581292","","10.3389/fonc.2021.753712"
"34777736","ECG Signal-Enabled Automatic Diagnosis Technology of Heart Failure","Chen L, Yu H, Huang Y, Jin H.","J Healthc Eng. 2021 Nov 3;2021:5802722. doi: 10.1155/2021/5802722. eCollection 2021.","Chen L","J Healthc Eng","2021","2021/11/15","PMC8580675","","10.1155/2021/5802722"
"34775971","Early prediction of hemodynamic interventions in the intensive care unit using machine learning","Rahman A, Chang Y, Dong J, Conroy B, Natarajan A, Kinoshita T, Vicario F, Frassica J, Xu-Wilson M.","Crit Care. 2021 Nov 14;25(1):388. doi: 10.1186/s13054-021-03808-x.","Rahman A","Crit Care","2021","2021/11/15","PMC8590869","","10.1186/s13054-021-03808-x"
"34772497","Artificial intelligence for mechanical ventilation: systematic review of design, reporting standards, and bias","Gallifant J, Zhang J, Del Pilar Arias Lopez M, Zhu T, Camporota L, Celi LA, Formenti F.","Br J Anaesth. 2022 Feb;128(2):343-351. doi: 10.1016/j.bja.2021.09.025. Epub 2021 Nov 9.","Gallifant J","Br J Anaesth","2022","2021/11/13","PMC8792831","","10.1016/j.bja.2021.09.025"
"34770432","Using Explainable Machine Learning to Improve Intensive Care Unit Alarm Systems","González-Nóvoa JA, Busto L, Rodríguez-Andina JJ, Fariña J, Segura M, Gómez V, Vila D, Veiga C.","Sensors (Basel). 2021 Oct 27;21(21):7125. doi: 10.3390/s21217125.","González-Nóvoa JA","Sensors (Basel)","2021","2021/11/13","PMC8587076","","10.3390/s21217125"
"34768540","Machine Learning Prediction Models for Mortality in Intensive Care Unit Patients with Lactic Acidosis","Pattharanitima P, Thongprayoon C, Kaewput W, Qureshi F, Qureshi F, Petnak T, Srivali N, Gembillo G, O'Corragain OA, Chesdachai S, Vallabhajosyula S, Guru PK, Mao MA, Garovic VD, Dillon JJ, Cheungpasitporn W.","J Clin Med. 2021 Oct 28;10(21):5021. doi: 10.3390/jcm10215021.","Pattharanitima P","J Clin Med","2021","2021/11/13","PMC8584535","","10.3390/jcm10215021"
"34765871","Predicting open wound mortality in the ICU using machine learning","Akiki RK, Anand RS, Borrelli M, Sarkar IN, Liu PY, Chen ES.","J Emerg Crit Care Med. 2021 Apr;5:13. doi: 10.21037/jeccm-20-154. Epub 2021 Apr 25.","Akiki RK","J Emerg Crit Care Med","2021","2021/11/12","PMC8579960","NIHMS1732035","10.21037/jeccm-20-154"
"34765104","The Promise for Reducing Healthcare Cost with Predictive Model: An Analysis with Quantized Evaluation Metric on Readmission","Teo K, Yong CW, Muhamad F, Mohafez H, Hasikin K, Xia K, Qian P, Dhanalakshmi S, Priya Utama N, Lai KW.","J Healthc Eng. 2021 Nov 2;2021:9208138. doi: 10.1155/2021/9208138. eCollection 2021.","Teo K","J Healthc Eng","2021","2021/11/12","PMC8577942","","10.1155/2021/9208138"
"34764679","Low-Density Lipoprotein Cholesterol is Inversely Associated with All-Cause Mortality of Patients in the Coronary Care Unit","Weng Y, Yin R, Qian L, Chen Z, Wang J, Xiang H, Xue Y, Ji K, Guan X.","Int J Gen Med. 2021 Nov 3;14:7659-7667. doi: 10.2147/IJGM.S332755. eCollection 2021.","Weng Y","Int J Gen Med","2021","2021/11/12","PMC8572731","","10.2147/IJGM.S332755"
"34760940","Novel Prognostic Predictor for Primary Pulmonary Hypertension: Focus on Blood Urea Nitrogen","Hu B, Xu G, Jin X, Chen D, Qian X, Li W, Xu L, Zhu J, Tang J, Jin X, Hou J.","Front Cardiovasc Med. 2021 Oct 25;8:724179. doi: 10.3389/fcvm.2021.724179. eCollection 2021.","Hu B","Front Cardiovasc Med","2021","2021/11/11","PMC8572959","","10.3389/fcvm.2021.724179"
"34758739","The effect of dobutamine in sepsis: a propensity score matched analysis","Zhu Y, Yin H, Zhang R, Ye X, Wei J.","BMC Infect Dis. 2021 Nov 11;21(1):1151. doi: 10.1186/s12879-021-06852-8.","Zhu Y","BMC Infect Dis","2021","2021/11/11","PMC8582172","","10.1186/s12879-021-06852-8"
"34753416","Mechanical power normalized to predicted body weight is associated with mortality in critically ill patients: a cohort study","Zhu Y, Peng W, Zhen S, Jiang X.","BMC Anesthesiol. 2021 Nov 10;21(1):278. doi: 10.1186/s12871-021-01497-1.","Zhu Y","BMC Anesthesiol","2021","2021/11/10","PMC8578006","","10.1186/s12871-021-01497-1"
"34749646","Estimated plasma volume status (ePVS) is a predictor for acute myocardial infarction in-hospital mortality: analysis based on MIMIC-III database","Chen J, Shen J, Cai D, Wei T, Qian R, Zeng C, Lyu L.","BMC Cardiovasc Disord. 2021 Nov 8;21(1):530. doi: 10.1186/s12872-021-02338-2.","Chen J","BMC Cardiovasc Disord","2021","2021/11/09","PMC8573972","","10.1186/s12872-021-02338-2"
"34747714","Risk Factors Associated With Nonfatal Opioid Overdose Leading to Intensive Care Unit Admission: A Cross-sectional Study","Mitra A, Ahsan H, Li W, Liu W, Kerns RD, Tsai J, Becker W, Smelson DA, Yu H.","JMIR Med Inform. 2021 Nov 8;9(11):e32851. doi: 10.2196/32851.","Mitra A","JMIR Med Inform","2021","2021/11/08","PMC8663596","","10.2196/32851"
"34738074","Machine learning in patient flow: a review","El-Bouri R, Taylor T, Youssef A, Zhu T, Clifton DA.","Prog Biomed Eng (Bristol). 2021 Apr;3(2):022002. doi: 10.1088/2516-1091/abddc5. Epub 2021 Feb 22.","El-Bouri R","Prog Biomed Eng (Bristol)","2021","2021/11/05","PMC8559147","","10.1088/2516-1091/abddc5"
"34733956","Recognizing blood pressure patterns in sedated critically ill patients on mechanical ventilation by spectral clustering","Liu S, Su L, Liu X, Zhang X, Chen Z, Liu C, Hong N, Li Y, Long Y.","Ann Transl Med. 2021 Sep;9(18):1404. doi: 10.21037/atm-21-2806.","Liu S","Ann Transl Med","2021","2021/11/04","PMC8506777","","10.21037/atm-21-2806"
"34733452","Sentiment Analysis for Necessary Preview of 30-Day Mortality in Sepsis Patients and the Control Strategies","Zou Y, Wang J, Lei Z, Zhang Y, Wang W.","J Healthc Eng. 2021 Oct 25;2021:1713363. doi: 10.1155/2021/1713363. eCollection 2021.","Zou Y","J Healthc Eng","2021","2021/11/04","PMC8560239","","10.1155/2021/1713363"
"34730820","Analysis of Discrepancies Between Pulse Oximetry and Arterial Oxygen Saturation Measurements by Race and Ethnicity and Association With Organ Dysfunction and Mortality","Wong AI, Charpignon M, Kim H, Josef C, de Hond AAH, Fojas JJ, Tabaie A, Liu X, Mireles-Cabodevila E, Carvalho L, Kamaleswaran R, Madushani RWMA, Adhikari L, Holder AL, Steyerberg EW, Buchman TG, Lough ME, Celi LA.","JAMA Netw Open. 2021 Nov 1;4(11):e2131674. doi: 10.1001/jamanetworkopen.2021.31674.","Wong AI","JAMA Netw Open","2021","2021/11/03","PMC9178439","NIHMS1807963","10.1001/jamanetworkopen.2021.31674"
"34730546","Natural Language Processing and Machine Learning Methods to Characterize Unstructured Patient-Reported Outcomes: Validation Study","Lu Z, Sim JA, Wang JX, Forrest CB, Krull KR, Srivastava D, Hudson MM, Robison LL, Baker JN, Huang IC.","J Med Internet Res. 2021 Nov 3;23(11):e26777. doi: 10.2196/26777.","Lu Z","J Med Internet Res","2021","2021/11/03","PMC8600437","","10.2196/26777"
"34727940","Interpretable time-aware and co-occurrence-aware network for medical prediction","Sun C, Dui H, Li H.","BMC Med Inform Decis Mak. 2021 Nov 2;21(1):305. doi: 10.1186/s12911-021-01662-z.","Sun C","BMC Med Inform Decis Mak","2021","2021/11/03","PMC8561378","","10.1186/s12911-021-01662-z"
"34724956","The obesity paradox and hypoglycemia in critically ill patients","Plečko D, Bennett N, Mårtensson J, Bellomo R.","Crit Care. 2021 Nov 1;25(1):378. doi: 10.1186/s13054-021-03795-z.","Plečko D","Crit Care","2021","2021/11/02","PMC8559391","","10.1186/s13054-021-03795-z"
"34722583","Association Between Serum Osmolality and Acute Kidney Injury in Critically Ill Patients: A Retrospective Cohort Study","Yang J, Cheng Y, Wang R, Wang B.","Front Med (Lausanne). 2021 Oct 15;8:745803. doi: 10.3389/fmed.2021.745803. eCollection 2021.","Yang J","Front Med (Lausanne)","2021","2021/11/01","PMC8553934","","10.3389/fmed.2021.745803"
"34722573","Clinical Value of the Lactate/Albumin Ratio and Lactate/Albumin Ratio × Age Score in the Assessment of Prognosis in Patients With Sepsis","Chen X, Zhou X, Zhao H, Wang Y, Pan H, Ma K, Xia Z.","Front Med (Lausanne). 2021 Oct 15;8:732410. doi: 10.3389/fmed.2021.732410. eCollection 2021.","Chen X","Front Med (Lausanne)","2021","2021/11/01","PMC8553960","","10.3389/fmed.2021.732410"
"34720754","Diagnostic Challenges in Sepsis","Duncan CF, Youngstein T, Kirrane MD, Lonsdale DO.","Curr Infect Dis Rep. 2021;23(12):22. doi: 10.1007/s11908-021-00765-y. Epub 2021 Oct 25.","Duncan CF","Curr Infect Dis Rep","2021","2021/11/01","PMC8544629","","10.1007/s11908-021-00765-y"
"34714247","Developing a RadLex-Based Named Entity Recognition Tool for Mining Textual Radiology Reports: Development and Performance Evaluation Study","Tsuji S, Wen A, Takahashi N, Zhang H, Ogasawara K, Jiang G.","J Med Internet Res. 2021 Oct 29;23(10):e25378. doi: 10.2196/25378.","Tsuji S","J Med Internet Res","2021","2021/10/29","PMC8590187","","10.2196/25378"
"34713061","Healthcare Transformation in Singapore With Artificial Intelligence","Liu S, Ko QS, Heng KQA, Ngiam KY, Feng M.","Front Digit Health. 2020 Nov 17;2:592121. doi: 10.3389/fdgth.2020.592121. eCollection 2020.","Liu S","Front Digit Health","2020","2021/10/29","PMC8521861","","10.3389/fdgth.2020.592121"
"34712956","Event Outlier Detection in Continuous Time","Liu S, Hauskrecht M.","Proc Mach Learn Res. 2021 Jul;139:6793-6803.","Liu S","Proc Mach Learn Res","2021","2021/10/29","PMC8549655","NIHMS1712776",""
"34705659","A Deep Language Model for Symptom Extraction From Clinical Text and its Application to Extract COVID-19 Symptoms From Social Media","Luo X, Gandhi P, Storey S, Huang K.","IEEE J Biomed Health Inform. 2022 Apr;26(4):1737-1748. doi: 10.1109/JBHI.2021.3123192. Epub 2022 Apr 14.","Luo X","IEEE J Biomed Health Inform","2022","2021/10/27","PMC9074854","NIHMS1798540","10.1109/JBHI.2021.3123192"
"34691290","A Retrospective Cohort Study on the Association between Red Cell Distribution Width and All-Cause Mortality of Patients with Cholecystitis at ICU Admission","Dong Y, Pan Y, Zhou W, Xia Y, Pan J.","Dis Markers. 2021 Oct 13;2021:9625220. doi: 10.1155/2021/9625220. eCollection 2021.","Dong Y","Dis Markers","2021","2021/10/25","PMC8528576","","10.1155/2021/9625220"
"34691236","Sentiment Analysis Based on the Nursing Notes on In-Hospital 28-Day Mortality of Sepsis Patients Utilizing the MIMIC-III Database","Gao Q, Wang D, Sun P, Luan X, Wang W.","Comput Math Methods Med. 2021 Oct 13;2021:3440778. doi: 10.1155/2021/3440778. eCollection 2021.","Gao Q","Comput Math Methods Med","2021","2021/10/25","PMC8528589","","10.1155/2021/3440778"
"34689614","A novel artificial intelligence based intensive care unit monitoring system: using physiological waveforms to identify sepsis","Mollura M, Lehman LH, Mark RG, Barbieri R.","Philos Trans A Math Phys Eng Sci. 2021 Dec 13;379(2212):20200252. doi: 10.1098/rsta.2020.0252. Epub 2021 Oct 25.","Mollura M","Philos Trans A Math Phys Eng Sci","2021","2021/10/25","PMC8805602","","10.1098/rsta.2020.0252"
"34683053","Examination of Electrolyte Replacements in the ICU Utilizing MIMIC-III Dataset Demonstrates Redundant Replacement Patterns","Ghannam M, Malihi P, Laudanski K.","Healthcare (Basel). 2021 Oct 14;9(10):1373. doi: 10.3390/healthcare9101373.","Ghannam M","Healthcare (Basel)","2021","2021/10/23","PMC8536187","","10.3390/healthcare9101373"
"34676253","The Prognostic Value of Calcium in Post-Cardiovascular Surgery Patients in the Intensive Care Unit","Bi S, Liu R, Li J, Chen S, Gu J.","Front Cardiovasc Med. 2021 Oct 5;8:733528. doi: 10.3389/fcvm.2021.733528. eCollection 2021.","Bi S","Front Cardiovasc Med","2021","2021/10/22","PMC8523822","","10.3389/fcvm.2021.733528"
"34676117","A Novel Nomogram for Predicting Survival in Patients with Severe Acute Pancreatitis: An Analysis Based on the Large MIMIC-III Clinical Database","Han D, Xu F, Li C, Zhang L, Yang R, Zheng S, Wang Z, Lyu J.","Emerg Med Int. 2021 Oct 11;2021:9190908. doi: 10.1155/2021/9190908. eCollection 2021.","Han D","Emerg Med Int","2021","2021/10/22","PMC8526213","","10.1155/2021/9190908"
"34675863","Admission Hyperglycemia Predicts Long-Term Mortality in Critically Ill Patients With Subarachnoid Hemorrhage: A Retrospective Analysis of the MIMIC-III Database","Liu D, Tang Y, Zhang Q.","Front Neurol. 2021 Oct 5;12:678998. doi: 10.3389/fneur.2021.678998. eCollection 2021.","Liu D","Front Neurol","2021","2021/10/22","PMC8525327","","10.3389/fneur.2021.678998"
"34675012","Value of early critical care transthoracic echocardiography for patients undergoing mechanical ventilation: a retrospective study","Jiang H, Xu W, Chen W, Pan L, Yu X, Ye Y, Fang Z, Zhang X, Chen Z, Shu J, Pan J.","BMJ Open. 2021 Oct 21;11(10):e048646. doi: 10.1136/bmjopen-2021-048646.","Jiang H","BMJ Open","2021","2021/10/22","PMC8532545","","10.1136/bmjopen-2021-048646"
"34671613","Serum Total Bilirubin Level Is Associated With Hospital Mortality Rate in Adult Critically Ill Patients: A Retrospective Study","Yang ZX, Lv XL, Yan J.","Front Med (Lausanne). 2021 Oct 4;8:697027. doi: 10.3389/fmed.2021.697027. eCollection 2021.","Yang ZX","Front Med (Lausanne)","2021","2021/10/21","PMC8520946","","10.3389/fmed.2021.697027"
"34658330","Long-term mortality predictors of ICU fungaemia","Xie P, Wang W, Dong M.","Epidemiol Infect. 2021 Oct 18;149:e241. doi: 10.1017/S0950268821002235.","Xie P","Epidemiol Infect","2021","2021/10/18","PMC8637461","","10.1017/S0950268821002235"
"34644744","Artificial intelligence forecasting mortality at an intensive care unit and comparison to a logistic regression system","Nistal-Nuño B.","Einstein (Sao Paulo). 2021 Oct 11;19:eAO6283. doi: 10.31744/einstein_journal/2021AO6283. eCollection 2021.","Nistal-Nuño B","Einstein (Sao Paulo)","2021","2021/10/13","PMC8483638","","10.31744/einstein_journal/2021AO6283"
"34642418","Machine learning for early discrimination between transient and persistent acute kidney injury in critically ill patients with sepsis","Luo XQ, Yan P, Zhang NY, Luo B, Wang M, Deng YH, Wu T, Wu X, Liu Q, Wang HS, Wang L, Kang YX, Duan SB.","Sci Rep. 2021 Oct 12;11(1):20269. doi: 10.1038/s41598-021-99840-6.","Luo XQ","Sci Rep","2021","2021/10/13","PMC8511088","","10.1038/s41598-021-99840-6"
"34642176","Varying association of laboratory values with reference ranges and outcomes in critically ill patients: an analysis of data from five databases in four countries across Asia, Europe and North America","Xu H, Agha-Mir-Salim L, O'Brien Z, Huang DC, Li P, Gómez J, Liu X, Liu T, Yeung W, Thoral P, Elbers P, Zhang Z, Saera MB, Celi LA.","BMJ Health Care Inform. 2021 Oct;28(1):e100419. doi: 10.1136/bmjhci-2021-100419.","Xu H","BMJ Health Care Inform","2021","2021/10/13","PMC8513264","","10.1136/bmjhci-2021-100419"
"34631839","Relationship Between First 24-h Mean Body Temperature and Clinical Outcomes of Post-cardiac Surgery Patients","Xu F, Zhang C, Liu C, Bi S, Gu J.","Front Cardiovasc Med. 2021 Sep 23;8:746228. doi: 10.3389/fcvm.2021.746228. eCollection 2021.","Xu F","Front Cardiovasc Med","2021","2021/10/11","PMC8494946","","10.3389/fcvm.2021.746228"
"34631829","Prognostic Association Between Perioperative Red Blood Cell Transfusion and Postoperative Cardiac Surgery Outcomes","Li Y, Cheang I, Zhang Z, Zuo X, Cao Q, Li J.","Front Cardiovasc Med. 2021 Sep 24;8:730492. doi: 10.3389/fcvm.2021.730492. eCollection 2021.","Li Y","Front Cardiovasc Med","2021","2021/10/11","PMC8497961","","10.3389/fcvm.2021.730492"
"34627022","A disease-specific language representation model for cerebrovascular disease research","Lin CH, Hsu KC, Liang CK, Lee TH, Liou CW, Lee JD, Peng TI, Shih CS, Fann YC.","Comput Methods Programs Biomed. 2021 Nov;211:106446. doi: 10.1016/j.cmpb.2021.106446. Epub 2021 Sep 30.","Lin CH","Comput Methods Programs Biomed","2021","2021/10/09","PMC8551061","NIHMS1746582","10.1016/j.cmpb.2021.106446"
"34623193","Developing clinical prediction models when adhering to minimum sample size recommendations: The importance of quantifying bootstrap variability in tuning parameters and predictive performance","Martin GP, Riley RD, Collins GS, Sperrin M.","Stat Methods Med Res. 2021 Dec;30(12):2545-2561. doi: 10.1177/09622802211046388. Epub 2021 Oct 8.","Martin GP","Stat Methods Med Res","2021","2021/10/08","PMC8649413","","10.1177/09622802211046388"
"34621131","Association Between Red Blood Cell Distribution Width-to-Albumin Ratio and Prognosis of Patients with Aortic Aneurysms","Long J, Xie X, Xu D, Huang C, Liu Y, Meng X, Cai X, Fang X.","Int J Gen Med. 2021 Oct 1;14:6287-6294. doi: 10.2147/IJGM.S328035. eCollection 2021.","Long J","Int J Gen Med","2021","2021/10/08","PMC8491781","","10.2147/IJGM.S328035"
"34620985","The OpenDeID corpus for patient de-identification","Jonnagaddala J, Chen A, Batongbacal S, Nekkantti C.","Sci Rep. 2021 Oct 7;11(1):19973. doi: 10.1038/s41598-021-99554-9.","Jonnagaddala J","Sci Rep","2021","2021/10/08","PMC8497517","","10.1038/s41598-021-99554-9"
"34620915","Digital signatures for early traumatic brain injury outcome prediction in the intensive care unit","Palepu AK, Murali A, Ballard JL, Li R, Ramesh S, Nguyen H, Kim H, Sarma S, Suarez JI, Stevens RD.","Sci Rep. 2021 Oct 7;11(1):19989. doi: 10.1038/s41598-021-99397-4.","Palepu AK","Sci Rep","2021","2021/10/08","PMC8497604","","10.1038/s41598-021-99397-4"
"34608464","SMAT: An attention-based deep learning solution to the automation of schema matching","Zhang J, Shin B, Choi JD, Ho JC.","Adv Databases Inf Syst. 2021 Aug;12843:260-274. doi: 10.1007/978-3-030-82472-3_19. Epub 2021 Aug 16.","Zhang J","Adv Databases Inf Syst","2021","2021/10/05","PMC8487677","NIHMS1722415","10.1007/978-3-030-82472-3_19"
"34604740","TSI-GNN: Extending Graph Neural Networks to Handle Missing Data in Temporal Settings","Gordon D, Petousis P, Zheng H, Zamanzadeh D, Bui AAT.","Front Big Data. 2021 Sep 15;4:693869. doi: 10.3389/fdata.2021.693869. eCollection 2021.","Gordon D","Front Big Data","2021","2021/10/04","PMC8480427","","10.3389/fdata.2021.693869"
"34604711","Improving natural language information extraction from cancer pathology reports using transfer learning and zero-shot string similarity","Park B, Altieri N, DeNero J, Odisho AY, Yu B.","JAMIA Open. 2021 Sep 30;4(3):ooab085. doi: 10.1093/jamiaopen/ooab085. eCollection 2021 Jul.","Park B","JAMIA Open","2021","2021/10/04","PMC8484934","","10.1093/jamiaopen/ooab085"
"34604298","Association Between Postoperative Thrombocytopenia and Outcomes After Coronary Artery Bypass Grafting Surgery","Li J, Yu D, Song Y, Cheang I, Wang X.","Front Surg. 2021 Sep 17;8:747986. doi: 10.3389/fsurg.2021.747986. eCollection 2021.","Li J","Front Surg","2021","2021/10/04","PMC8484630","","10.3389/fsurg.2021.747986"
"34600327","Multi-faceted semantic clustering with text-derived phenotypes","Slater LT, Williams JA, Karwath A, Fanning H, Ball S, Schofield PN, Hoehndorf R, Gkoutos GV.","Comput Biol Med. 2021 Nov;138:104904. doi: 10.1016/j.compbiomed.2021.104904. Epub 2021 Sep 27.","Slater LT","Comput Biol Med","2021","2021/10/02","PMC8573608","","10.1016/j.compbiomed.2021.104904"
"34596575","Medical Data Mining Course Development in Postgraduate Medical Education: Web-Based Survey and Case Study","Yang L, Zheng S, Xu X, Sun Y, Wang X, Li J.","JMIR Med Educ. 2021 Oct 1;7(4):e24027. doi: 10.2196/24027.","Yang L","JMIR Med Educ","2021","2021/10/01","PMC8520135","","10.2196/24027"
"34593872","Effect of ondansetron on reducing ICU mortality in patients with acute kidney injury","Guo X, Qi X, Fan P, Gilbert M, La AD, Liu Z, Bertz R, Kellum JA, Chen Y, Wang L.","Sci Rep. 2021 Sep 30;11(1):19409. doi: 10.1038/s41598-021-98734-x.","Guo X","Sci Rep","2021","2021/10/01","PMC8484575","","10.1038/s41598-021-98734-x"
"34591016","A Machine Learning Sepsis Prediction Algorithm for Intended Intensive Care Unit Use (NAVOY Sepsis): Proof-of-Concept Study","Persson I, Östling A, Arlbrandt M, Söderberg J, Becedas D.","JMIR Form Res. 2021 Sep 30;5(9):e28000. doi: 10.2196/28000.","Persson I","JMIR Form Res","2021","2021/09/30","PMC8517825","","10.2196/28000"
"34587637","Examining the Concordance in the Documented Pressure Injury Site, Stage, and Count in Medical Information Mart for Intensive Care-III","Zhang W, Sotoodeh M, Ho JC, Simpson RL, Hertzberg VS.","Appl Clin Inform. 2021 Aug;12(4):897-909. doi: 10.1055/s-0041-1735179. Epub 2021 Sep 29.","Zhang W","Appl Clin Inform","2021","2021/09/29","PMC8481012","","10.1055/s-0041-1735179"
"34586931","Establishment of a prognostic model for patients with sepsis based on SOFA: a retrospective cohort study","Liu H, Zhang L, Xu F, Li S, Wang Z, Han D, Zhang F, Lyu J, Yin H.","J Int Med Res. 2021 Sep;49(9):3000605211044892. doi: 10.1177/03000605211044892.","Liu H","J Int Med Res","2021","2021/09/29","PMC8485318","","10.1177/03000605211044892"
"34577227","Assessment of Non-Invasive Blood Pressure Prediction from PPG and rPPG Signals Using Deep Learning","Schrumpf F, Frenzel P, Aust C, Osterhoff G, Fuchs M.","Sensors (Basel). 2021 Sep 8;21(18):6022. doi: 10.3390/s21186022.","Schrumpf F","Sensors (Basel)","2021","2021/09/28","PMC8472879","","10.3390/s21186022"
"34575711","Feature Explanations in Recurrent Neural Networks for Predicting Risk of Mortality in Intensive Care Patients","Na Pattalung T, Ingviya T, Chaichulee S.","J Pers Med. 2021 Sep 19;11(9):934. doi: 10.3390/jpm11090934.","Na Pattalung T","J Pers Med","2021","2021/09/28","PMC8465577","","10.3390/jpm11090934"
"34573790","The Problem of Fairness in Synthetic Healthcare Data","Bhanot K, Qi M, Erickson JS, Guyon I, Bennett KP.","Entropy (Basel). 2021 Sep 4;23(9):1165. doi: 10.3390/e23091165.","Bhanot K","Entropy (Basel)","2021","2021/09/28","PMC8468495","","10.3390/e23091165"
